Nombre,Puntuacion_IMDB,Puntuacion_Rotten_Tomatoes,Director,Guionistas,Argumento,Duracion
Éter,N/A,N/A,Isabel Barajas,Isabel Barajas,"Mariana is received in a small community circus thanks to the support of Andrés. When he dies during the circus show everyone suspects of Mariana, even herself.",N/A
Moleque,N/A,N/A,Marcos Pena,Roberto Gómez BolañosMarcos Pena,"Inspired by El Chavo del Ocho, one of the most successful TV series in the world, the short film tells the story of Moleque (translated from the original title ""El Chavo"", which is ""brat"" in Spanish), a ten-year-old street kid who lives behind food. One day he meets Soneca, an older churro vendor, who, seeing the boy walking barefoot, decides to give him a pair of gif... Leer todo",N/A
Alive,N/A,N/A,Joost Caniëls,Yentl de JongGustavo Ruben Valenzuela,,N/A
P.S.,N/A,N/A,Jaron Pront,Ramon Hartman,,N/A
Broken,N/A,N/A,Christopher Renney,Christopher Renney,From a broken family and a broken home. This short film showcases a day in the life of a young boy who lives with his alcoholic and abusive father and is stuck in a terrible cycle.,N/A
La Voleuse Du Monde,N/A,N/A,Letizia Giannelli,Anastasia ReshetnikovaGustavo Ruben Valenzuela,,N/A
NADA: Act 1,N/A,N/A,Jasmina Cibic,Jasmina Cibic,,N/A
Without A Word,N/A,N/A,Youness Benali,Youness Benali,"Without A Word, is a film where movements express feelings and emotions, where no words do.",N/A
Kimi ga iru kara,N/A,N/A,Takahiro Fukuya,Takahiro FukuyaYôsuke Miyagi,,N/A
Railroad,N/A,N/A,Daeil Kim,Daeil Kim,"After a tragic happening, a girl is riddled with guilt and the lines between reality and dreams begin to blur",N/A
Emigrant (Mohager),N/A,N/A,Mahmoud Al Jabaly,Rama Tahan,,N/A
The Wall of a Nation,N/A,N/A,Samuel Poulin,Marc-Antoine GénéreuxPhilippe KirouacSimon Malouin,,N/A
"Ted, Fred & Deb",N/A,N/A,Harry Sherriff,Harry Sherriff,,N/A
Beauty Queen,N/A,N/A,DJ Walker,Alex Cruz,Ever wanted to know what it took to go from the everyday man to becoming the queen that lives inside of you? Mr. Alex Cruz dares to show you how. Watch as he transforms before your very eyes into the stunning Miss Wynters.,N/A
Rasse,N/A,N/A,Wesley Howard,Wesley Howard,"A young boy Stefan, calls himself ""Paco"" to be accepted amongst his friends, who are mostly foreigners. As he gets in to trouble with his friend Dejan, the others have to decide between origin and friendship. His closest female friend Mergime, who he grew up with, struggles the most and tries to save Paco with a risky plan.",N/A
Just the Two of Us,N/A,N/A,Brian Patto,Michael MackHester van der Vyver,,N/A
Inner Monologue,N/A,N/A,Kieran Wall,Elizabeth Jones,,N/A
Afterparty,N/A,11%,Kieran Wall,Elizabeth JonesAlex MillerKieran Wall,,N/A
Bravo: Machinima United,N/A,N/A,Garrett Hayworth,Burnie BurnsJon GrahamGarrett Hayworth,"In a world where Machinimas are decreasing in popularity, one movie has set out to change it all - in style.",N/A
Aus Liebe zum Alkohol,N/A,N/A,Jonas EmsJonas Wuttke,Jonas EmsJonas Wuttke,,N/A
Sangre y Levadura,N/A,N/A,Juan Carlos Mazo,Juan Carlos Mazo,,N/A
Client A,N/A,N/A,Gulab Chaggar,Lady Mya AmariseMaryam JivaBharat Mistri,A girl trapped by family traditions and expectations is forced to consider a life changing decision.,N/A
Cosmorama,N/A,N/A,Eren Aksu,Serdar BakiogluGülce Oral,,N/A
Gojen,N/A,N/A,Jubaraj Baruah,Jubaraj Baruah,"Raktim is searching for Gojen, an activist gone into oblivion, in a sub-urban alley of Kolkata. Instead, he finds an acquaintance of Gojen's, Mr Dasgupta.",N/A
A Thousand Nights,N/A,N/A,Xiaoyu Yang,Xiaoyu Yang,,N/A
Whistle,N/A,N/A,Daeil Kim,Daeil Kim,"With the presentation of a woman through a mysterious TV screen, a lonely man seeks solace in this unlikely relationship. However, not all love stories end happily.",N/A
Chronicles of the Caste-Free - Chapter I,N/A,N/A,Raghu Mandaati,Raghu MandaatiAllam Vamshi,,N/A
The Red Box - La Boîte Rouge,N/A,N/A,Patrizia De LauretisThea Marti,Bob Perks,,N/A
Reading Between the Lines,N/A,N/A,Martha Davis,Martha Davis,"Reading the replies to a personal ad she has placed, a woman imagines herself in relationships with three different men. The first man is young, domestic and likable, the second rich exciting and arrogant and the third older, exuberant and vulnerable. (The late clown and mime artist Richard Pochinko plays the third man in his only film role.) The classic dating scenar... Leer todo",N/A
Ghost Walk: The Harvest Ball,N/A,N/A,Steve Olander,Rocky Karlage,"First film for the beginning of ""The Ghost Walk Saga"" series of films - ""The Harvest Ball"" foreshadows the Dawson family film series ""The Ghost Walk Saga"". Nominated for ""Best Animation"" at the 2017 Finow Film Festival, Germany.",N/A
Reverse,N/A,N/A,Alfred L. Lowe,N/A,Reverse is about a elder man who hates people of color. He will experience trials & tribulations and be forced to rethink his past revealing his reasons of why he hates people of color.,N/A
The Pursuit of Love,N/A,N/A,Enoc Daniel Rodriguez,Enoc Daniel Rodriguez,"Mini drama about 2 guys that feel love one for each other, but their parents don't accept that relationship, So they decide to escape together and thus be happy for an eternity.",N/A
Afternoon Clouds,N/A,N/A,Payal Kapadia,Payal Kapadia,"Kaki is a 70 year old widow who lives with her Nepali domestic help, Malti in Mumbai. The film takes place on one afternoon in their house where a flower blossoms in the balcony. Malti meets a boy, a sailor from her hometown unexpectedly. In the meanwhile, men in the passage spray mosquito repellant that gives Kaki bad dreams.",N/A
Value,N/A,N/A,EJ Levy,EJ LevyAidan Warren,"While dealing with the death of his closest friend Cameron, Aidan, one of Cameron's oldest friends and room mate, suddenly starts to develop PTSD as he starts to recall the events that lead to Cameron's death.",N/A
Looking Away,N/A,N/A,Jacob Ramsay,Dimitar DimoskiJacob Ramsay,"When a 9-year-old boy learns that his father has a mistress, he must decide whether or not to tell his mother.",N/A
First Kiss,N/A,N/A,Nora Särak,Nora Särak,,N/A
Gusti,N/A,N/A,Abdullah Fikri Ismanto,Martinus Tito HendrawanAbdullah Fikri Ismanto,"After traveling for so long, going back to my hometown is the dream of many people. But, what if you are unable to be able to chat with family on Hari Raya?",N/A
Freshman,N/A,94%,Max Strand,Ben CohenMax Strand,,N/A
Recherche,N/A,N/A,Andrea Belcastro,Andrea Belcastro,,N/A
Wiem,N/A,N/A,Piotr Nalazek,Piotr Nalazek,,N/A
Eskimo,N/A,89%,Robyn Killian,Robyn Killian,,N/A
Akrasia,N/A,N/A,Dylan Counts,Jeremy Lee C.,,N/A
Choose Your Misery Wisely,N/A,N/A,Sewi Ryu,Sewi Ryu,Two girls who faces unwanted sufferings wind up in two different paths.,N/A
The Eye,N/A,N/A,Qiuyu Chen,Qiuyu Chen,,N/A
The Strong Brothers,N/A,N/A,Trent Walker,Trent Walker,,N/A
Le violon et l'aiguille,N/A,N/A,Alexandre CotiLéo Faure,Alexandre CotiLéo Faure,,N/A
Chakope,N/A,N/A,N/A,N/A,,N/A
Miesten juoma,N/A,N/A,Nana TimonenSara Valavaara,Henni KoskiKrista KuitunenSamuli Lukkarinen,Aatos struggling with acceptance and courage of being who he is on his 50th birthday party.,N/A
De glace,N/A,N/A,Nikodem Rautszko,Nikodem Rautszko,,N/A
The Bear,N/A,N/A,Amy Force,Amy Force,1. The dream 2. The telling,N/A
The Second Home,N/A,N/A,Suveer Bhambhani,Kabir Thapar,,N/A
Where's Daddy?,N/A,100%,Arlette Thomas-Fletcher,Arlette Thomas-Fletcher,Maurice a very smart energetic young boy is angry and lashing out all because he misses his father being in his life.,N/A
Elevators,N/A,N/A,Hessam Daraei,Hessam Daraei,A man tries to use the elevators in a building but none of them works.,N/A
Krig,N/A,N/A,Rasmus Fabricius,Rasmus Fabricius,"In war-torn Denmark, a brother and sister fight for survival as they embark on a perilous journey through the violent and dangerous landscape, where they must stay vigilant to avoid the hostile and vicious Danes.",N/A
The Foreigner,N/A,N/A,Taruna Khanagwal,Alexandra GoldNalneesh NeelKumar Saurabh,"A single, foreign woman begins living in a new building and decides to hire a plumber. The plumber is enraptured by her beauty and introduces her to his friends. What happens next forms the rest of the film.",N/A
Le spectre du fer,N/A,N/A,Maxime Simone,Maxime Simone,,N/A
Disznóvágás,N/A,N/A,Noémi Veronika Szakonyi,Ádám FarkasMáté FazekasAndrás Dezsõ Horváth,"Anna and Attila are a young, happy couple engaged to be married. Upon Anna's insistence, Attila finally takes her to meet his family. There's a long-standing feud between Attila and his brother Zsolt, which can perhaps be resolved, yet it won't be easy. The parents slaughter a pig on the occasion of their son's return. Things appear to be going well, until Anna's phon... Leer todo",N/A
Perspective,N/A,N/A,Brandon Lees,Brandon Lees,,N/A
The Bread Winner,N/A,N/A,Agazi Desta,Agazi Desta,"A young boy, Josie, will do whatever it takes to bring bread back to his family.",N/A
Tiparu,N/A,N/A,Suraj Dalvi,Suraj Dalvi,,N/A
Ride Away,N/A,N/A,Alicia MacGibbon,Heileen AriasSam Wexler,,N/A
Bandada,N/A,N/A,Alberto GiovencoLaura Gracia,Alberto Giovenco,"Why a man should close himself voluntarily for more than eight years in a farmhouse near by the city? The documentary ""The invisible Ivan"" attempts to answer this question thanks to Marc's queries, the interviewer, and the replies of Leonardo and Miriam, the respondents. Something, however, goes wrong and the normal continuation of the scene is irreparably compromised... Leer todo",N/A
Krov,N/A,N/A,Pavel Roytberg,Pavel Roytberg,"In 2017-2018, supernatural beings will emerge from hiding, end their ""masquerade"" and stop living in shadows. Future of coexistence with those, who consider ordinary people to be the basis of a food chain, rests on your shoulders :)",N/A
78.4,N/A,N/A,Tiago Amorim,Tiago AmorimPedro Ramalho Marques,"Late 80's. Manuel, a young announcer of Rádio Plutão - a small pirate radio station he has in his attic -, considers abandoning the project and deals with his colleague leaving for a job in an official radio station.",N/A
Missing,N/A,56%,Sam Ward,Jack DeVos,,N/A
Encaisse,N/A,N/A,France Timmermans,Lucie BernardMarie LachetFrance Timmermans,,N/A
Road Kill,N/A,68%,Lawren Campbell,Lawren CampbellJennifer McGrath,,N/A
Orla,N/A,N/A,Mateus Moura,Sid QuaresmaCarline Ramos,"The story begins with a murder that takes place on the edge of Icoaraci, Belém district, which puts into check an old relationship between two characters during a dialogue. ""The short film aims to convey to the public, from an ironic point of view, and therefore unprepared, the absurdity of the existence of drives and relationships. It's a movie that has sympathy for ... Leer todo",N/A
Venster,N/A,N/A,Gerhard Mostert,Maatje Burger Smith,,N/A
Take Your Birth Control,N/A,N/A,Jackson Adams,Anna AkanaMaggie Levin,"This is a book excerpt adaptation from Anna Akana's ""So Much I Want To Tell You: Letters To My Little Sister""",N/A
Lilac Wednesday,N/A,N/A,Rose Chang,Rose Chang,A misunderstood teenager attempts to connect with her depressed mother but tragically discovers that it is too late.,N/A
Cascaritas,N/A,N/A,Eduardo Hunter,Eduardo Hunter,"Carlos travels to the place of his childhood and there he remembers those adventurous and dangerous afternoons he used to spend with Mateo, his best friend. A friendship that was put to the test and that one day he lost without much explanation, but he always hopes to find it again.",N/A
Não Esquecerás,N/A,N/A,João Mário Grilo,Dulce Maria CardosoLuís Mário Lopes,,N/A
If Only You Were Mine,N/A,N/A,David Benedek,David BenedekJakub SpevákJán Stiffel,"Dominik is a young graduate experiencing his first relationship. Adam becomes a mentor, idol and first love for him. With great feeling, there are also great uncertainties. He finds out that he doen't belong to his world of young Bratislava, but he still tries to make their relationship work.",N/A
Mnemonics,N/A,N/A,Daniela Repas,Daniela RepasIvana Repas,A refugee stores her memories in boxes that are animated to life when she revisits them in her secret room.,N/A
Je Suis Un Coin À Champignon,N/A,N/A,Thomas Gerard,Thomas Gerard,,N/A
Flicker,N/A,N/A,Xingzhong Zhao,Xingzhong Zhao,,N/A
Susurro bajo la Tierra,N/A,N/A,Lilia Alcalá,Lilia Alcalá,,N/A
Falso autostop,N/A,N/A,Marco David Calce,Marco David CalceFabio Natale,,N/A
Ancien to Mahou no Tablet: Mou Hitotsu no Hirune Hime,N/A,N/A,Kenji Kamiyama,Harumi DokiKenji Kamiyama,"The story centers on the adventure of Ancien, a girl that keeps appearing in Kokone's dreams. The story of the dream is one that Kokone's father told her as a mysterious fairy tale when she was little.",N/A
Inner Flame,N/A,N/A,Vardit Bilu,Tami AssoulineVardit Bilu,"Gali is a deaf dancer who dreams of a career as a fully-fledged dancer in a professional, well-known and well-regarded troupe of hearing dancers. A troupe that has never had a deaf dancer. Filled with excitement, hopes and fears, she arrives at the troupe's tryouts day, and decides to proceed without any accommodations and without barriers. She chooses to conceal her ... Leer todo",N/A
Don't Look,N/A,20%,Jack McLoughlin,N/A,"Andrea lives alone plagued by nightmares, however one night she discovers something is with her in the apartment.",N/A
Nuclear Rainbow,N/A,N/A,Calum Young,Calum Young,Two distant brothers are forced to reconnect with each other after many years when an unexpected tragedy in the family occurs.,N/A
Strings,N/A,80%,Vardit Bilu,Vardit BiluJohnatan Pinto,"It is the 1960s in a development town in Israel. Rachel is a downtrodden widow who works as a seamstress, struggling to earn a living while raising her deaf son. She doesn't have the language with which to talk to him, and most of the communication between them is limited to basic gestures. In the course of her work, she meets a wealthy woman who suggests that Rachel ... Leer todo",N/A
A Date in the Park,N/A,N/A,Edgar P. Davis,Edgar P. Davis,,N/A
Frammenti,N/A,N/A,Davide Fois,Davide Fois,,N/A
Nausea,N/A,86%,Raha Amirfazli,Raha Amirfazli,,N/A
Zar Min HaCholot,N/A,N/A,Tamar Baruch,Tamar Baruch,"An Eritrean refugee emerges from the desert to a small rural community in southern Israel,. He yearns to belong but holds on to the memory of the lover he left behind.",N/A
Modern Lennon,N/A,N/A,Jack McLoughlin,N/A,"A struggling musician who works as an John Lennon impersonator, navigates through his daily walk into the city.",N/A
Glabra,N/A,N/A,Peter RundleAlexandros Klimopoulos,Peter Rundle,"After discovering a map and a photograph in his grandfathers belongings, Steve embarks on a quest to reveal the truth behind his findings.",N/A
Verde,N/A,N/A,Marco Mazzone,Marco Mazzone,,N/A
Boxing Two Step,N/A,N/A,Steven G. Lowe,Steven G. Lowe,,N/A
Garage Heat,N/A,N/A,Dickie Hearts,Joseph Ausanio,,N/A
Au Nom Du Père,N/A,N/A,Hugo Will-Boissonat,Hugo Will-Boissonat,Two men meet after years for one last face to face.,N/A
Parcialmente Nublado,N/A,N/A,Gabriel Souza NunesIvan Santaella,Gabriel Souza NunesIvan Santaella,"With no electricity at home and alone during a storm, Caio has to reevaluate his life decisions in the dark.",N/A
L'esseulé,N/A,N/A,Camille Degeye,Camille Degeye,"A man wakes up in the desert. Walking to find the city, he sees the disappearance of men. When the memory of a beloved woman reappears in her mind, the past begins to touch, slowly.",N/A
Sanctuary,N/A,89%,Ostin Fam,Ostin Fam,,N/A
Dance Revenge,N/A,N/A,Sirvan Marogy,Sirvan Marogy,,N/A
Scrape,N/A,N/A,Lorenzo Trane,Filippo D'AntuonoLorenzo Trane,,N/A
Caffè Cerutti,N/A,N/A,Elmos C. Neocleous,Anna Tenezi,"Holiday season. Two friends, Diana and Katy, meet in Caffe Cerutti after not having seen each other for a while. Diana is spontaneous, enthusiastic and ready to hear her friend's news. However, their meeting is about to have an unexpected twist when the cafe's interior decoration causes strange reactions to Katy.",N/A
Secret,N/A,N/A,David Benedek,David Benedek,,N/A
Mind's Eye,N/A,N/A,Neil Cadieux,Neil Cadieux,,N/A
Suite 212,N/A,N/A,Hugo Pedro,N/A,,N/A
Short Cut,N/A,N/A,Ostin Fam,Ostin Fam,"Mae believes that unlike what her long black locks suggests, beauty is found in short hair. In desperation, she defies all odds to attain her desired crown of beauty.",N/A
The Unknown,N/A,N/A,Steven James,Emily CrawSteven James,A young boy named Isaac is given a chance to bring change to his aimless life.,N/A
Forever,N/A,N/A,Paulina Sjoberg,Paulina Sjoberg,,N/A
La desserte rouge,N/A,N/A,Hugo Martin,Hugo Martin,,N/A
Lost,N/A,N/A,Mitchel Johnson,Mitchel Johnson,,N/A
Love Forever,N/A,N/A,Karan Chawla,VikramRaj Singh ChauhanNarinder Kaur ChawlaSufi Jazbaat,,N/A
Skerm,N/A,N/A,Anja van den BergCobus van den Berg,Anja van den Berg,,N/A
Parallax,N/A,N/A,Aline Magrez,Aline Magrez,"Big machines. Laughters. Or rather screams. A fair and its disturbing weirdness. Refugee in a labyrinth of mirrors, a man sinks into the darkness of his bruised mind. His memories, dreams and fantasies pass. Like a feeling of drowning in a funnel which closes on a frightening empty infinity.",N/A
Colours of Life,N/A,N/A,Karan Chawla,N/A,,N/A
Broken,N/A,N/A,Johnny Hough,Johnny Hough,Four vignettes of a grieving girl on a cloudy day.,N/A
Rêverie,N/A,N/A,Servane Royant,Chloé BalluNina RichardServane Royant,,N/A
Unforgotten,N/A,N/A,Robert Jackson,Beth CunninghamJacob MathesonJason Digbeth,"After committing a murder, a woman tries to bury her guilt like she did her victim's body. Little does she know, a sharp-eyed detective is closing in on her.",N/A
Time Irreversible,N/A,N/A,Stanley Nsamba George,Stanley Nsamba George,,N/A
Goalkeeper,N/A,N/A,Fahad Alestaa,Fahad Alestaa,A Former Goalkeeper Watches a Television Interview that Brings him Back to the Spotlight.,N/A
Abused Child,N/A,N/A,James La Motta,James La Motta,"""I have been sexually and physically abused for as long as I can remember until I was 14 - When I finally had the courage to lock the door at night and sit next to it.""",N/A
Seeking,N/A,N/A,Sahand Mohajer,Sahand Mohajer,"A solitary figure reaches for a presence that remains ungraspable, prompting the figure to face his own confinement and slip out of a long bittersweet solitude dealing with loss.",N/A
Ma'am,N/A,N/A,Marta Morilla,Marta Morilla,"An experimental short film about love, addictions, and loneliness",N/A
Einmal zuviel,N/A,N/A,Wilda Wahnwitz,Nick BrardtRagnar FelgnerAnne Vehres,,N/A
Bedsheet Man,N/A,N/A,David Leo,David LeoAndrew C. Maier,This movie is about the pain that comes from losing a child to suicide and the abnormal way one man deals with his grief - through becoming a superhero. Seeking revenge from the person he thinks drove his son to suicide - our hero is determined to become the hero his son always wanted him to be.,N/A
Day 99,N/A,N/A,Grayson Whitehurst,Grayson Whitehurst,A man reckons with his past following 99 days of an airborne epidemic.,N/A
Ka zhu ren sheng,N/A,N/A,Sheng-Ming Huang,Sheng-Ming Huang,"Yu-Yin is a math teacher in a junior high school, She plays a very important role in both her students and her family's lives. However she receives the trickiest question in life just when she was about to go on a relaxing trip. Jun-Ho, an adolescent boy in 9th grade, is going through the chaos of his parents divorce and the great pressure of going to high school. Wit... Leer todo",N/A
The Small Things,N/A,N/A,Arthur Gonzales,April BurnsArthur Gonzales,At a casual party two people meet and forge a loving relationship with each other. They learn that the small things count. Life carries on.,N/A
El Mal Amor,N/A,N/A,Sergio González-Román,Sergio González-Román,,N/A
El Camino de los Perros,N/A,N/A,Sebastián Cuevas,Paula Armstrong,"Jorge (17) travels from Chiloé to Santiago to look for his unknown father, however, when he arrives he finds a disconcerting surprise that will turn his trip around.",N/A
La Uva - The Grape,N/A,N/A,Arturo Mombiedro,Arturo Mombiedro,,N/A
Stay a Little While,N/A,N/A,Sheng-Ming Huang,Yi HungJiun-Wen RanYu-Shin Yang,"Yi-Jia invited her childhood friend Yang and her new friend Jia-Bao to pose as her photography project models. The three talked about their past, present and future. Suddenly, they realized that ""growing up"" is just around the corner. If the daylight came, we all had to become the grown-ups who don't know each other. Would you stay with me in Neverland, forever?",N/A
Hunter's Mercy,N/A,N/A,Matthew Clay,J. Cody AndersenBrad Bentz,,N/A
Aimée,N/A,N/A,Daan Groot,Ashgan El Hamus,,N/A
Burn Bridge,N/A,N/A,Rhys Marc Jones,Rhys Marc Jones,"Harry and Jamie are inseparable until Lucy arrives on the scene. Now Harry must contend for Jamie's attention, bringing his true feelings closer to light.",N/A
Casse Noisette,N/A,N/A,Justine Lefevre,Justine Lefevre,"There is something missing in Barychnikov, whose life is punctuated by inexplicable deliveries of hazelnuts. On the advice of the deliveryman Dutronc, Barychnikov will seek help in the maze of a genealogical society, where rooms open on the stage of a staged memory.",N/A
Eternal holidays,N/A,N/A,Tilek Cherikov,N/A,,N/A
Cypress Tree,N/A,N/A,Emery McGaha,Emery McGaha,,N/A
Aator (Perfume),N/A,N/A,Aniket Mitra,Aniket Mitra,An emotional conversation between an old seller of perfumes and a father who is forced by his son to sell their ancestral property.,N/A
X,N/A,N/A,Raquel Choy,Raquel Choy,Do you dare to immerse yourself in the mind of a psychopath? What if you like what you see...?,N/A
W.I.F.E,N/A,N/A,Ronald J. Wright,Emma Wise,,N/A
Chasing the GOAT,N/A,N/A,Celeste Holben,George Gardner,,N/A
Death of the Dragonslayer,N/A,N/A,Christian B. Hansen,Anna Louise Yeates Arnesen,,N/A
Doce,N/A,N/A,Celia Fernández PoyatosClaudia Jara Rodríguez,Victoria Rodríguez CruzCelia Fernández PoyatosClaudia Jara Rodríguez,,N/A
Grands sont les déserts,N/A,N/A,Léa Renard,Léa Renard,"Mateo, twenty, lives in a Corsican village. There he meets Eva who pulls him from his dreams and takes him to meet Alvaro. To his first attraction for the girl then mixes a troubled fascination for this boy.",N/A
Talking Trees,N/A,N/A,Joel Brandt,Adriel BrandtJoel Brandt,Two disillusioned revolutionaries mourn the death of their inspiring leader and make a surprising new friend.,N/A
Life in 2 Minutes,N/A,N/A,Elie Fahed,Elie Fahed,"This is how I see life, in 2 minutes.",N/A
Dxgal,N/A,N/A,Hung En Su,Hung En Su,"A Truku elder, Temu, still continues the practice of farming, even after he transferred the farmland to his son. One day, Temu's clan held a ritual to pray for a good harvest, meanwhile his son is having a discussion with Mr. Chen, who had been sent by an enterprise to deal with land acquisition.",N/A
The Flame,N/A,N/A,Jui-Liang HsuTai-Wei Huang,Jui-Liang HsuTai-Wei Huang,"Heavily indebted, Tai is forced to work for commercial debt collectors. He wishes to leave everything behind and start from scratch with his sister who suffers from depression. In private, Tai is actually a masked wrestler. After he accidentally defeats the supposed winner in a fight, his life takes a different turn.",N/A
Muñeca,N/A,N/A,Karina FlomenbaumValeria Perez Delgado,Karina FlomenbaumValeria Perez Delgado,,N/A
Hacia el sur,N/A,N/A,Camila Selser,Gibrán Portela,,N/A
Will,N/A,N/A,Quincy Huanxi Li,Quincy Huanxi Li,,N/A
Jon & Joanne,N/A,N/A,Quincy Huanxi Li,Quincy Huanxi Li,,N/A
Premonicion,N/A,N/A,Leticia Akel,Leticia AkelBrúsi Ólason,"Javier arrives in a small farming community to look for a job, but has to fight against Chivo's prejudices to win his place in the community.",N/A
The Resolve,N/A,N/A,Sam Litovchin,Sam Litovchin,,N/A
Saturno,N/A,N/A,Gabriel Vinícius,Gabriel Vinícius,The return of Saturn brings a reflective monologue about life and a human through the eyes of a man trying to connect this cycle.,N/A
Midnight Tod,N/A,N/A,Yi-Ling Wang,Yi-Ling Wang,"Due to his rebellious personality, Hao gets fired from his work. He takes all his belongings to stay at Tod's place. Unsatisfied with the current situation but remaining hopeful to the future, they try to do something to against the world and get what they deserve, even they have to go separate ways.",N/A
When We Meet Again,N/A,N/A,William Sehested Høeg,William Sehested Høeg,"Mads has been traveling across Europe for three months with his two childhood friends, Simon and Sara. To celebrate his safe return, Mads' family has organised a welcome home lunch - but the meal is interrupted by a call from Sara's father claiming Sara was raped on the last night of the trip. This throws Mads into the biggest dilemma of his life.",N/A
Forged Love,N/A,N/A,Mikey William Cheung,Mikey William Cheung,A teenager goes through grief as he tries to understand his relationship issues.,N/A
Animal,N/A,N/A,Alex Cole,Pedro Takahashi,A teenage girl makes a disturbing discovery whilst walking her dog through the woods.,N/A
Eva,N/A,64%,Wesley MulderMilou Rohde,Samira Id BellaThomas BoerDan van Steen,,N/A
Cuando venga a por mi,N/A,N/A,Fania Vázquez,Beatriz Maciá,,N/A
Cena Familiar,N/A,N/A,Marc Zaragoza,Alfredo BeldaRubén MechóCarlos Rodas,,N/A
Wilderness,N/A,33%,Jeremy Wallace,Jeremy Wallace,"Adapted from Carl Sandburg's poem, Wilderness, this film explores a the trials and tribulations of a relationship and how their emotional states embody the characteristics of animals.",N/A
Leap in the Dark,N/A,N/A,Yusuf Elbasi,N/A,A timid young man's journey in the heart of darkness.,N/A
Domestic Violence,N/A,91%,Camila Fonseca,Scott LipmanAlessio MedasTerezie Vraspírová,,N/A
Disquiet,N/A,0%,Francisco Steward,Tatána JanevováTony MasekCurt Matthew,,N/A
Heart On My Sleeve,N/A,N/A,Kevin J. O'Neill,Vincent DeMarcoIttyKevin J. O'Neill,,N/A
Leo,N/A,N/A,Nicolas Bellaiche,Nicolas Bellaiche,"Leo, a simple minded giant, loses the precarious balance he had found in jail.",N/A
