Nombre,Puntuacion_IMDB,Puntuacion_Rotten_Tomatoes,Director,Guionistas,Argumento,Duracion
Wash,N/A,N/A,Zhichun Huang,Zhichun Huang,Newly immigrated Chinese mother and daughter who are going through the threshold of cultural assimilation live under the situation of water shortage in a shabby household in Los Angeles.,N/A
The Day We (Un)Met,N/A,N/A,Amy Benjamin,Eric James Gravolin,,N/A
Pause,N/A,N/A,Andrew Hostler,Michael St. Germain,,N/A
Joana D'arc,N/A,N/A,Bruno Autran,Bruno Autran,"The recent scenery of intolerance in Brazil and around the World, makes Joan of Arc survives.",N/A
Cousins,N/A,56%,Nick Madison,Nick Madison,"Several estranged cousins come together after the death of their grandparents, but they quickly learn that things will never be the same.",N/A
15 Minutes,N/A,32%,Nick Madison,Nick Madison,"Teenagers Luke and Scarlet fall in and out of love and after a tragedy, Dr. Sparbel must help Luke come to terms with reality.",N/A
Arsénica,N/A,N/A,Jonathan Diaz Mayagoitia,Jonathan Diaz Mayagoitia,,N/A
The Cipher,N/A,N/A,Christopher Davison,Christopher DavisonBethany Marie Wilson,,N/A
Inside Voices,N/A,N/A,Christine Eunji Kim,Christine Eunji Kim,A story about a girl who never says what she means to say. And the one time she does.,N/A
Brokers,N/A,N/A,Siamak Kashefazar,Siamak Kashefazar,,N/A
Cause to Play,N/A,N/A,Fafe Knapp,Fafe Knapp,,N/A
Red Light Monk,N/A,N/A,Oswald Thomas,Oswald Thomas,,N/A
Butterflies,N/A,N/A,Stefani Raycheva,Stefani Raycheva,When does children grow up?,N/A
Naked and Silent,N/A,N/A,Panini Rajkumar,Gautam KapurGautam Sharma,,N/A
Plattentausch,N/A,N/A,Felix GerbrodAndreas Thedens,Felix GerbrodAndreas Thedens,"Three people are locked up in a bunker after an apocalyptic event, they cope well, but only have two records left.",N/A
Here for Family,N/A,N/A,Brandon J. Rivers,Courtney Davis,"When the son of a broken but spiritual family is in a horrific accident, the family must try and keep it together with all the gilt while supporting there love one. While the son is fighting for his life.",N/A
Kairós,N/A,N/A,Tatiana Wisniewski,Tatiana Wisniewski,,N/A
Ghost of a Body,N/A,N/A,Tatiana Wisniewski,Tatiana Wisniewski,"After years of being abused by her partner, she decides to put an end to it.",N/A
Daydream,N/A,N/A,Genevieve Kertesz,Genevieve KerteszJoshua Todd,"Mitch is a man who lives a controlled life with a self imposed strict set of rules and boundaries. One night he is dragged against his wishes into a fantasy strip club called ""Daydream"" where he meets Emily.",N/A
Aquarium,N/A,N/A,Youssef Sanheji,Youssef Sanheji,"Sarra, a young autistic girl finds herself locked up home by her mother Hend who does not accept her illness. Obsessed by her social reputation, Hend devotes herself to her daughter and decides to cure her in her own way.",N/A
Asrar Al-Rih,N/A,N/A,Imène Alnasiri Boulos,Imène Alnasiri Boulos,"Océane is a little blind girl. She spends her days playing at the edge of the beach. She is very attached to her grandfather. Her grandfather enters the depths of the sea on a day of a great storm. While waiting for him, Oceane crystallizes and becomes a wax doll.",N/A
1999,N/A,N/A,Haithem Sakouhi,Haithem Sakouhi,"The narrator, a screenwriter, tells his life as well as the daily life of his street artists friends in a brand new reality context.",N/A
Barzakh,N/A,N/A,Insaf Arafa,Insaf Arafa,A moment of life of a young couple who finds themselves facing a probable eternal separation.,N/A
The Sexlife of a Chair,N/A,N/A,Phil Mulloy,N/A,,N/A
Cowboys: Outrage!,N/A,N/A,Phil Mulloy,N/A,,N/A
Cowboys: That's Nothin',N/A,N/A,Phil Mulloy,N/A,,N/A
Cowboys: The Conformist,N/A,N/A,Phil Mulloy,N/A,,N/A
The Ten Commandments Number 5: Thou Shalt Not Kill,N/A,N/A,Phil Mulloy,N/A,,N/A
Nonkina tosan Yamazaki kaido,N/A,N/A,Hakusan Kimura,Yutaka Aso,,N/A
Career Day,N/A,N/A,Renee Kennedy,Renee Kennedy,,N/A
Pool Fart,N/A,N/A,Tamara BrukettaTybee DiskinBenji Dolly,N/A,"A pool party, rambunctious teen fun, what harm could one little fart do? Right?",N/A
Culture Club,N/A,N/A,KT Kent,Jewel GreenbergKristy Thomas,,N/A
Hospital Head Doctor,N/A,N/A,Dean Fleischer Camp,Dean Fleischer CampJenny Slate,,N/A
Best Man,N/A,N/A,Michael Goitanich,Michael Goitanich,,N/A
Something Remotely Beautiful,N/A,N/A,Mykola Yeriomin,Mykola Yeriomin,A strange congratulation on the occasion of International Women's Day.,N/A
Dadz,N/A,N/A,Quinn Wilson,Sean Cooley,"It's hard being a dad, but it rewarding being a dad. They are each others Dad, don't think about it too much.",N/A
A szennyes,N/A,N/A,Nándor LörinczBálint Nagy,Nándor LörinczBálint Nagy,,N/A
Pizza,N/A,96%,Anna Yatsenko,Aleksandr Zherebko,,N/A
Jinglehiemer's Candy Factory,N/A,N/A,Joey Taurtis,Joey Taurtis,,N/A
Khodyachiye Otmorozki,N/A,N/A,Anna Sof'ina,Nikolai Gostyukhin,Snowmen are coming and the village has worrier to protect them but what's his side?,N/A
7 or 8,N/A,N/A,Valentin Smirnov,Nikolai Gostyukhin,,N/A
Night Walkers,N/A,N/A,Christopher Lang,Christopher Lang,,N/A
Wolkenkrabber,N/A,N/A,Jan Martien Dekker,N/A,,N/A
Frimerker,N/A,N/A,Hilde Serena Maxwell,Cristo BorracheroHelene KvinlaugBenjamin Lønne Røsler,"A pub, a group of friends and a seemingly innocent practical joke. In essence, That is all it takes for Preben to find himself in a crunch as he meets Mari and invites her back to his place. His plans are - well - let's just say things may not work out quite as planned and therefore Preben discovers that he isn't quite the person he thought he was. He finally has to m... Leer todo",N/A
A Lost Hope,N/A,N/A,John Bird,John Bird,Darth Vader survives the rebel attack and finds a new home living in a London flat with a stormtrooper and working in a local office.,N/A
Panties 4 Sale,N/A,N/A,Latonya Morgan,Latonya Morgan,"A woman is led to believe that she is losing her store, so she has her cashier hire someone to rob the store in order to collect the insurance, but something aren't always what they seem.",N/A
Office Improvs,N/A,N/A,Robin Pearce,Jennifer BellairsSte BerginJemma Codd,,N/A
Noise For Music,N/A,N/A,Davide Fois,Valentina Cicogna,,N/A
Je Suis Un Salaud,N/A,N/A,Thomas Gerard,Thomas Gerard,,N/A
Pocker diabolique,N/A,N/A,Olivier Gardnair,Olivier Gardnair,"Enclosed in a basement, five people engage in a particular poker game. Whenever a player loses, he has to shoot himself in the head.",N/A
Casual Delivery,N/A,N/A,Zach Glover,Zach Glover,,N/A
A Christmas Story,N/A,N/A,Friedrich Reimer,Friedrich Reimer,A crude experimental animation depicting the unlikeliest of rescues during the holiday season.,N/A
Mr. Fries,N/A,N/A,Gang Wang,Matt Marlin,Mr. Fries never expects that his perfect weekend brunch plan would be changed by a random stranger.,N/A
The Inventor of Shotgunning Beer,N/A,N/A,Daniel CodeNima GholamipourCameron MacLeod,Daniel CodeNima GholamipourCameron MacLeod,Recollection Cinema explores the history of shotgunning beer and talks to the man who invented this evolution in the art of drinking beer from a can.,N/A
En die wiele van die bus gaan om en om,N/A,N/A,Pieter Grobbelaar,André StolzSandra VaughnIsabella Mostert,,N/A
The Reaper,N/A,N/A,Samantha Potochick,Samantha Potochick,,N/A
Abetment,N/A,N/A,Samantha Merkle,Nate Brav-McCabe,"""An aging, lonesome father desperately asks his son to aid in his suicide, but when his son shows little to no hesitation a gruesomely honest argument arises.""",N/A
A Love That Kills,N/A,N/A,Jonathan Sohn,Robert Ahn,A dark romantic comedy about two people looking for love - and who happen to be serial killers too.,N/A
Mean Guys,N/A,N/A,Ben Hagarty,Dave BurdVon MillerRob Gronkowski,,N/A
Errei - Canal Mosaico,N/A,N/A,Denise Sganzerla,Denise Sganzerla,,N/A
Recursos Humanos,N/A,N/A,Agustín Kazah,Nacho Albani,,N/A
Dave,N/A,95%,Rebecca DeanePhilip Doherty,Kieran FalooneMike RobinsonPhilip Doherty,,N/A
Fiat/Zoolander 2 Blue Steel Selfie,N/A,N/A,Jeff MannMike Goedecke,Rachel Yanovski,,N/A
The Cold War,N/A,N/A,Nora Long,Jamie BartholNora Long,"Two interns with their own unique and feisty personalities, battle for a job where there can be only one. One likes it hot, the other cold.",N/A
Religious Freedom,N/A,N/A,Peter Dolan,Peter Dolan,,N/A
The Ultimate Wedding,N/A,N/A,Stanley Nsamba George,Stanley Nsamba George,,N/A
Santa Valentine,N/A,N/A,Aris Koulaidis,Nick ChanakoulasAris Koulaidis,,N/A
Becoming a Woman,N/A,N/A,Kevin Christopher,Angie AlbeckMarianne DiMascio,Young Sally anticipates the many changes associated with becoming a woman.,N/A
Cousine,N/A,N/A,Alek Imanov,Tamilla Zeynalova,,N/A
Hollywood sur Seine,N/A,N/A,Audrey EspinasseSami Lorentz,Audrey EspinasseSami Lorentz,"Richard from Épinay tells us the crazy and fabulous story of Eclair Studios. Devoured by the passion of cinema, he makes us discover with his acolytes his Hollywood-on-Seine, where Louis Jouvet or Jean Gabin are regularly invited.",N/A
The Kickback,N/A,N/A,Malik Baker,Malik Baker,A music producer decides to throw a listening party for his artist.,N/A
Cat Ladies,N/A,N/A,Alana GospodnetichTess HannaJolene Kennedy,Alana GospodnetichTess HannaVella Lovell,,N/A
Uncle Pervis Goes Out To Eat,N/A,N/A,Aaron Avont Johnson,Aaron Avont Johnson,,N/A
Uncle Pervis Section 8 Haunted House,N/A,N/A,Aaron Avont Johnson,Aaron Avont Johnson,,N/A
Piracy Is Not a Victimless Crime,N/A,N/A,Garden Greene,Garden Greene,A boy develops a sense of nostalgia for the taste of envelope glue as he writes to his father on death row for pirating Disney movies.,N/A
Red or Blue,N/A,N/A,P. Pradeep Kumar,Prithvi KannanRemya Mukundan,,N/A
Just My Luck,N/A,14%,Gbemi Oluwayimika,N/A,Hapless driver is trapped in a parking garage by a saucy ticket machine.,N/A
Token of Love,N/A,N/A,Laura Brincat,Laura Brincat,"Our story takes place over the course of a summer with an estranged mother and daughter, who discover that the mother has breast cancer. So they make a deal: the daughter will drive the mother to her treatment and sit with her everyday, and in exchange, the mother will share her medicinal marijuana.",N/A
Jay Alvarrez's Younger Brother Timmy,N/A,N/A,Peighton Tubre,Peighton Tubre,"A lot is known about Jay Alvarrez and his girlfriend Alexis Ren, but little is known about his younger brother...Timmy. Timmy is tired of living in the shadow of his older brother and wants to show the world that his life is just as exciting.",N/A
Coffee Run,N/A,N/A,Aaron Mak,Aaron Mak,"When one mate suggests to his other mate that they should go grab some coffee, they embark on a journey across Australia's countryside that amounts to the most ridiculous coffee run anyone's ever done.",N/A
Blood Relations,N/A,17%,Jason McGhinnis,Scott Woodard,Every family has things they wish would remain hidden. Some families have secrets that must never. get. out.,N/A
The Story of Night School,N/A,N/A,Lucas Haugland,Lucas HauglandDavid LudvigssonSebastian Sanneh,,N/A
Finger,N/A,N/A,Yuriy Karabak,Vasiliy BashaIrina BibikAleksey Zubkov,"One day in the life of the plant workers. Kirill, a factory lathe operator, arrives to work suffering from a terrible hangover and looks for the hair of the dog. As he doesn't succeed in his enterprise, Kirill uses an industrial accident in his favor.",N/A
Counter Religion,N/A,N/A,Ernst ZorinAnastasia Zorin-Machado,Anastasia Zorin-MachadoVinicius Zorin-Machado,,N/A
The Dick,N/A,N/A,Rian Lennon,Molly ClarkeRyan EarlyCormac McDermott,,N/A
After Party,N/A,N/A,Gunnar Peterson,Gunnar Peterson,,N/A
Where in the World is the Twirlcopter?,N/A,N/A,Cara Deptula,Cara Deptula,"The Twirlcopter Cara Deptula adventures from location in California doing twisty and twirly things on her head. Random cartoon characters pop up to add a kitschy, unique cutesy humor. Music Artist Heather Gruber sings the song ""Snowglobe"" from the album ""Imagination""",N/A
End of the World,N/A,14%,Dunya Djordjevic,N/A,"When a mom of two discovers the world is going to end in less than 12 hours, she embarks on a mission to fulfill her destiny -- to woo George Clooney.",N/A
Open Wide,N/A,N/A,Martin Stirling,Rosie Gaunt-Mathieson,"A young girl pays a visit to the doctor, but things don't go quite as she expects.",N/A
Arranca,N/A,N/A,Javier Farias,Javier Farias,,N/A
Brad,N/A,N/A,Brandon Petrizzo,Madeline HartleyBrandon Petrizzo,,N/A
Momma's Boy,N/A,N/A,Sandra Tilley,Sandra TilleySandra Tilley,A young man chooses an unorthodox way to escape from the clutches of his assertive mother.,N/A
Dad Trap,N/A,N/A,Hunter Stair,Jeremy HurlburtDan SachoffErni Walker,"A comic take on the popular TV series To Catch a Predator, with a shocking twist.",N/A
Life Tutorials,N/A,N/A,John Noel,John Noel,,N/A
Nyumbang,N/A,N/A,Rahma Nurlindasari,Agustinus Dwi Nugroho,"Pak Bejo and Sutini are a poor family in a small village on a mountainside. The harvest of their rice fields fail and Sutini who sell fried snacks in the market also was not doing well with the selling. In the most difficult days of their life. There were many events was held in a village and due to the culture rules, everyone has to attend and donate money. The frust... Leer todo",N/A
Gimp Tiger,N/A,N/A,Sean Gallen,Alan Wanders,,N/A
Tinder Documentary,N/A,N/A,Sarah Lew,Ihila Lesnikova,,N/A
Chandler Duke 4 Prez,N/A,N/A,Vivian Miranda,Chandler DukeVivian Miranda,,N/A
Dinner Party,N/A,85%,Cecilio Martinez,Cecilio Martinez,,N/A
Cervantes Dogs,N/A,N/A,Jonathan González,Jonathan González,,N/A
The Box,N/A,N/A,Leo Josefsson,Leo Josefsson,"The Box is more than a film or a musical experience. The Box is a call to arms; an all out declaration of war against those who seek to define us, chiseling our roles and our realities in stone.",N/A
Break a Leg!,N/A,67%,Jonathan Petermann,Jonathan Petermann,,N/A
Le banquet des hommes illustres,N/A,N/A,Philippe BarbenesOlivier Brunet,Philippe BarbenesOlivier Brunet,"During this improbable meal Voltaire replies to Churchill and Rabelais to Thomas Jefferson, Colette squares up against Napoleon - and all with a wine-loving, bon vivant master of ceremonies in the shape of French actor Pierre Arditi.",N/A
What ThunderCats is Really About,N/A,N/A,Dave Urlakis,Dave Urlakis,What IS ThunderCats really about?,N/A
Bloodgurgler,N/A,N/A,Daniel James,Adam Ransley,"Bloodgurgler is a dark comedy/thriller which highlights the potential dangers of a life online, particularly when playing games with people whose real-life identities we don't know. Computer-based role play games have become a significant part of the lives of many adolescents and young adults, and Bloodgurgler taps in to the excitement, the thrill, the terror experien... Leer todo",N/A
"Sorry, You're Not Hamilton",N/A,N/A,Randy Rainbow,Randy Rainbow,Randy predicts that Hamilton will sweep the Tony Awards.,N/A
Actor Speak,N/A,N/A,Cleveen Dominguez,Belle Adams,,N/A
Copspeak,N/A,N/A,Hayden Simpson,Scott CavalheiroHannah CheesmanMatt Gordon,,N/A
Welcome to Finland,N/A,N/A,Nabil Fathi,Nabil Fathi,,N/A
Happy Villain's Time Day,N/A,N/A,Divyansh Pandit,Vikkas Vicky Sharma,,N/A
Faqr Hai,N/A,N/A,Divyansh Pandit,Vikkas Vicky Sharma,,N/A
Hot Business,N/A,N/A,Joey Jawiche,Bobby BurrelliLouise GiavasKaralee Austin,,N/A
Rocks,N/A,97%,Feng-I Fiona Roan,Leif Eric Johnson,,N/A
What Do Adults Play?,N/A,N/A,Vladislav Muko,Vladislav Muko,,N/A
Re da ¿Da o No da?,N/A,N/A,Nacho Álvarez,Andrés Aloi,,N/A
I Love America Comedy,N/A,N/A,Peter Boiadzhieff,Jeff Justice,"He is not a famous person, but he has a big dream, to be on Conan O'Brien show ... In Atlanta the dreams come true at The Punchline Atlanta's Best Comedy Club. I love America, here if you dream big anything is possible.",N/A
The Economy Parody,N/A,N/A,Peter Boiadzhieff,Peter Boiadzhieff,"Peter Boiadzhieff promise to recover the American Dream for every hard working person in America. These are the three things in his program: 1. Brand new yacht. 2. Solve the economy, eliminate the dept with removing the three zeros, give a start capital with adding three zero, and 3. Everyone should own a bridge. Sarah Heike (Jamie Keenan)- Reporter of KnVideoStudio s... Leer todo",N/A
Hot Mess,N/A,N/A,Hazel Hayes,Hazel Hayes,,N/A
Delivered 7:42,N/A,N/A,Jonathon Ferino,Jonathon Ferino,,N/A
The Great Bambino,N/A,N/A,Zachary Trussell,N/A,,N/A
Popcorn and Gin,N/A,N/A,Michael CartyTrish Crist,Trish Crist,,N/A
Etreintes,N/A,N/A,Anthony Belliot,Jean-Baptiste BazinAnthony BelliotMathilde Roger,A maniac receives a young woman at home for the evening. He then uses his art to put her at ease.,N/A
The AC is too high?,N/A,N/A,Masashi Yamashita,Masashi Yamashita,"A certain summer day. Mika Shiota, a company employee who always works silently in the corner of the company. Even though it's midsummer, the office is still very cold today because somebody has cooled the AC. Therefore, she wants to go to the restroom immediately. Mika heads to the restroom, but all are in use. Despite the limits of patience, visitors have come. ""It ... Leer todo",N/A
T and Me,N/A,N/A,Matt Martin,Kirk Buckhout,,N/A
Kidnapped,N/A,N/A,Samuel Pilbeam,Samuel Pilbeam,,N/A
A,N/A,50%,Agnishwar Mukherjee,Arin Paul,,N/A
Hair and Brimstone,N/A,N/A,P.J. Liguori,Louis GrantP.J. LiguoriSophie Newton,"The dark and twisted adventures of Hades, Aubrey and Robin in their hair salon, Hair and Brimstone.",N/A
The Lumberjack's Pub,N/A,N/A,Jasmine Alexander,Jasmine AlexanderEric D. Altman,Lumberjacking friends Sam and Frank take a chance at making their life-long stories into a TV show. Stay tuned to find out why this was the only episode they ever filmed-- B-roll and all.,N/A
Meita,N/A,N/A,Dário Guerreiro,Dário Guerreiro,,N/A
Melhor Que Enfardar,N/A,N/A,Dário Guerreiro,Dário Guerreiro,,N/A
The Ideal Family,N/A,N/A,Andrea Diprè,Andrea Diprè,,N/A
Hats,N/A,N/A,Evan Snyder,Evan Snyder,Skeletons and fishermen show off their cool new hats and their crazy dance moves.,N/A
Farmland of Horror,N/A,N/A,Lucas Echikson,Lucas Echikson,A segment from a terrible horrible film where a man is chased by a murderer at a farm.,N/A
The Fake Witch Project,N/A,N/A,Lucas Echikson,Lucas Echikson,A parody of The Blair Witch Project.,N/A
Do I Have Superpowers?,N/A,N/A,Lucas Echikson,Lucas Echikson,A kid tries to see if he has superpowers.,N/A
Expectation VS Reality,N/A,N/A,Lucas Echikson,Lucas Echikson,Comparing the expectations and realities of a few things.,N/A
Living Flipphone,N/A,N/A,Lucas Echikson,Lucas Echikson,A young man is sent a flip phone that terrorizes him.,N/A
My Dating Video,N/A,N/A,Lucas Echikson,Lucas Echikson,A typical dating profile video you'd find on the dating sites.,N/A
Solitaire,N/A,N/A,Lucas Echikson,Lucas Echikson,A man playing solitaire is consistent interrupted by someone else.,N/A
El flechazo,N/A,N/A,Sergio Balaguer Orfao,Ruiz Mulero AntonioPam SaavedraDerrick Álvarez,,N/A
Dear David (Attenborough Animation),N/A,N/A,Annie Murray,Annie Murray,,N/A
Stick Figures Go Nuts 2,N/A,N/A,Drew Bromley,Zachary BaschBrendan BromleyDrew Bromley,Stick Figures do random stuff again in this particular picture.,N/A
Cuando tu subconsciente te traiciona,N/A,N/A,Lucero Pasarán,Manuel AlejandroClaudia Rangel,,N/A
Art Cheaters,N/A,N/A,Will Storie,Jeremiah Budin,,N/A
Strange Man in Atlanta,N/A,N/A,Peter Boiadzhieff,Peter Boiadzhieff,"Peter is walking in mid town Atlanta, first time in the town and the strange man approached him and strike a conversation. Peter is performing Comedy trying to be funny at Comedy Club Punchline Atlanta.",N/A
Noir Prefers the Shadows,N/A,N/A,Chris ParkerTerri Birnbaum,Terri BirnbaumChris Parker,"A down-at-heel private detective, a guy who can't even pay the rent, finally gets a couple clients. One, a desperate businessman who wonders why the competition is always one step ahead of him, sees conspiracy everywhere. The other seems much easier to deal with - she's a cute dish whose questions seem less concerned with intrigue, and more with philosophy, and perhap... Leer todo",N/A
Cherry & Pepper Play It Dirty,N/A,N/A,Olga MolinaSara GraciaIsabel Lopez,N/A,,N/A
Les Shadoks et la maladie mystérieuse,N/A,N/A,Thierry Dejean,Thierry DejeanJacques RouxelMichaël Souhaité,,N/A
Bee Stung in Big Little Bees,N/A,N/A,Marko Djordjevic,Marko DjordjevicFilip DjuricStefan Milosavljevic,,N/A
More For Me,N/A,N/A,Erin McLaughlin,Maeve Kern,,N/A
Salifornia,N/A,N/A,Andrea Beluto,Andrea Beluto,,N/A
Chicken Lover,N/A,N/A,Jason Kuchar,Jason KucharOakland Valleau,,N/A
Golden Tuna - Montreal Sessions,N/A,N/A,Jenny Cartwright,Douce AngoisseJenny CartwrightDavid Cherniak,"After leaving Berlin, French multidisciplinary artist Golden Tuna surfs Montreal's cold and dark wave to find inspiration.",N/A
Tasty,N/A,N/A,Spencer Elmore,Spencer Elmore,A hopeful chef prepares a meal for a woman looking to impress her; she isn't.,N/A
T.E.V.,N/A,N/A,Tyler A.M.,Tyler A.M.,An anxious slob questions her reality when she meets a semi-familiar face.,N/A
Sick Day,N/A,N/A,Mark Needle,Joel DavisMark Needle,,N/A
Free The Nipple,N/A,18%,Anna CallegariSam KlemmerCaralyn Stone,Anna CallegariSam KlemmerCaralyn Stone,,N/A
The Reunion,N/A,N/A,Irina Octavia Andronic,Irina Octavia Andronic,,N/A
Pokémon Writers Room,N/A,N/A,Jonah Feingold,Max GodnickMichael GoodmanAdam Weinrib,,N/A
Hamiltrump,N/A,N/A,Joey FishmanGabriel Lyons LoebMatt Spevack,Max Godnick,,N/A
Honest Roommates,N/A,N/A,Nick Rasmussen,Lyndsey Frank,,N/A
Santa's Not Real?,N/A,N/A,Sammy Paul,Alexis Salas,Young Alexis is sat down to hear the truth about Christmas.,N/A
Versus Dating,N/A,N/A,Robin Thedenat,Robin Thedenat,,N/A
Regeneration,N/A,100%,Sarah Conley,Sarah Conley,,N/A
Marco e il nonno,N/A,N/A,Roberta Mucci,Alberto CavalliniRoberta Mucci,,N/A
Save A Frat Pledge,N/A,N/A,Aaron Zarabi,Aaron Zarabi,,N/A
How To Pee In Public In NYC,N/A,N/A,Aaron Zarabi,Aaron Zarabi,,N/A
Braggadocious!,N/A,N/A,Randy Rainbow,Randy RainbowRichard M. ShermanRobert B. Sherman,Official music video of Braggadocious.,N/A
Inside The Cave: The 3 Day Jesus Musical,N/A,N/A,Jay FarnieBen Granger,Jay FarnieBen Granger,A musical short that explores what Jesus was up to post-resurrection.,N/A
De Schlëssel,N/A,N/A,Lilian Cornelis,Eugénie Asselin,,N/A
Núll Núll 9,N/A,N/A,Daði Einarsson,Daði EinarssonÞorgrímur Þráinsson,,N/A
Hip With It,N/A,N/A,Lloyd Darling,Lloyd Darling,,N/A
Hacker,N/A,79%,Peter Kelly,Rachel JoravskyPeter Kelly,,N/A
Beyond the reach of stars,N/A,N/A,Vincent Lamanna,Anthony A. Labriola,"Armed with arcane knowledge and in search of ancient treasure, one adventurer finds himself face to face with cosmic evil like no other.",N/A
Funny Money,N/A,N/A,Ryder Insua,Ryder InsuaAmy MeyersMegan Sampson,Four struggling clowns make one last ditch effort to save their business.,N/A
La Cleptomane,N/A,N/A,Aytl Jensen,Alexandra BellAytl JensenFanny Chevalier,,N/A
Lo del agua al agua,N/A,N/A,Luis Ramos,Abraham ElizaldeErnesto FuentesKatery,,N/A
TJ Street,N/A,N/A,Charles Germain,Charles Germain,Students from all over the world meet and interact with American born students. They all are facing awkward use of language as well as different cultural patterns.,N/A
That Guy,N/A,N/A,Drew DullJustin Strandlund,Justin Strandlund,"Three friends embark on a night out in Chicago, only to realize that there aren't any places that Richard hasn't been kicked out of.",N/A
Hurtling,N/A,N/A,Leon Elliott,Leon Elliott,,N/A
He's Home,N/A,N/A,Adrian Dean,Adrian Dean,A naughty couple tries to escape the site of their mischief without being seen by the mystery man who has just arrived back home.,N/A
Fashion Week: A Comedy,N/A,N/A,Nelson Ascencio,Nelson Ascencio,Sketch comedy short inspired by the iconic and seasonal New York Fashion Week.,N/A
The Layoff,N/A,N/A,Luke Harlan,Luke Harlan,,N/A
14 Karat Industries: About Us,N/A,N/A,Eric Simons,Eric Simons,,N/A
Pick Me,N/A,N/A,Caroline Duncan,Caroline DuncanCarly Roland,,N/A
Drawing Vs Artist,N/A,N/A,Omar Khaled,Omar Khaled,,N/A
If It Ain't Baroque,N/A,N/A,Gregg Jaffe,Gregg Jaffe,"A happy couple celebrate their anniversary by exchanging gifts, leading to an exploration of self-expression and attempts at pleasing the one you love. Or maybe say it with a very large, very strange body tattoo.",N/A
Skip,N/A,N/A,Jenina MacGillivray,Jenina MacGillivray,"In a coastal town in Newfoundland a man named Skip cares for his widowed grandfather, admires the local store clerk from afar and dreams of making something of his life through an unlikely endeavor: rock skipping.",N/A
Messiah,N/A,N/A,Anthony Dickenson,Colin McKeanChris Willis,,N/A
Amordázame,N/A,N/A,Álvaro de Armiñán,Evaristo HurtadoCelia Núñez,"A maid receives a surprise visit from her brother who just escaped from prison, and tries her best to help him get money.",N/A
Kleptomania,N/A,N/A,Paloma Hernandez,Paloma Hernandez,A remorseful thief returns stolen goods to their rightful owners unaware of the chaos it will ensue.,N/A
Chaplin in the Toilet,N/A,N/A,Juan Manuel F. Pozzo,Juan Manuel F. Pozzo,,N/A
Childproofing 101,N/A,N/A,Jeremiah Budin,Jeremiah Budin,,N/A
The Big Thirst,N/A,N/A,Gabriel Athanasiou,Lazaros Kolaxis,Young Odysseus discovers that something is going terribly wrong when he decides to visit his father's village for the first time.,N/A
The Tap,N/A,N/A,Alanna Rose,Alanna Rose,An Aboriginal community in North West NSW is still waiting for a tap and pipeline to be installed to supply clean running water. But unfortunately all the funds and resources have gone into bureaucracy and endless unneeded reports.,N/A
Blind Detective,N/A,55%,Sean Oliver,Drew LeathamSean Oliver,A man gets lost in a virtual world while trying to solve a mystery game. Blind to the real world around him the player ends up in a mystery of his own.,N/A
Send Off,N/A,N/A,Justin Blake Webber,Justin Blake Webber,"After a man receives a n important letter in the mail, he goes to every length to hide it. Until his wife finds it and their lives will never be the same.",N/A
