Nombre,Puntuacion_IMDB,Puntuacion_Rotten_Tomatoes,Director,Guionistas,Argumento,Duracion
Exodus: Gods and Kings,"6,0",31%,Ridley Scott,Adam CooperBill CollageJeffrey Caine,"El desafiante líder Moisés se levanta contra el faraón egipcio Ramsés II, poniendo a seiscientos mil esclavos en un monumental viaje de escape de Egipto y su aterrador ciclo de plagas mortales.",2h 30min
Nandigramer Chokher Pani,,,Sarfaraz Alam Safu,Manik Mandal,,1h 50min
Love You Bangaram,,,Goverdhan Reddy,,Love You Bangaram is a 2014 Telugu language romantic drama film directed by Goverdhan Reddy. It is produced by Maruthi Films. The film has Rahul Haridas and Shravya in the lead roles.,
WHO U.S.?,,,Kristin MacCary,Kristin MacCary,,1h 2min
Behind the Door of a Secret Girl,"9,4",,Janessa StarkeyJack Kohler,Jack KohlerJanessa Starkey,"Sammy is a teenage cutter living with her meth addicted mother in a trailer on the Indian Ridge Reservation. Her mother's boyfriend is a drug dealer using the reservation as a cover for his drug trafficking. David, Sammy's best friend, is a foster youth and helps her to escape from this dysfunctional life she's had to endure since her father died.",1h 40min
Agadir Express,,,Youssef Fadel,Youssef Fadel,"Aziz is on the run as he is being chased by three angry brothers, who are out for revenge for what happened to their sister. He seeks acknowledgment and safety from Daoui, a pensioner living alone. Together they take a tragic travel full of challenges.",1h 30min
3 Mile Limit,"5,9",,Craig Newland,Andrew GunnCraig Newland,"It's 1965 and rock music is shaking up the world but not in New Zealand. Richard Davis a 23 year old journalist is determined to break the Government's monopoly on broadcasting and bring rock n' roll to a younger generation, and at the same time hold onto the woman he loves. Based on a true story.",1h 45min
Chilla,"6,2",,Saodat Ismailova,Saodat IsmailovaUlugbek Sadykov,"40 Days of Silence is the story of four women in Central Asia in key moments of their lives, discovered through their different ages. It is a trip into an unconscious and intimate female world; it is an attempt to portray broken identities and women who confront their own will to choose and decide.",1h 28min
Kobzar. Istoriya odniyeyi knyhy,,,Serhiy SotnychenkoTaras Tkachenko,Taras Tkachenko,"The film explores Taras Shevchenko's biography of Kobzar, to be precise, of three of his editions, which saw the light of life in 1841, 1844, and 1860. Related issues are also covered, such as the emergence of the alphabet, the textology of Shevchenko's works and his friendly correspondence, his first trip to Ukraine, his arrest, and his last journey of 1860, censorsh... Leer todo",52min
Her Wilderness,"7,2",,Frank Mosley,Frank Mosley,"An elliptical, minimalist narrative of a lost, wandering child in the wake of an affair that may or may not have even happened.",1h 5min
Born of War,"4,4",35%,Vicky Jewson,Ben HerveyVicky JewsonRupert Whitaker,"After her family is killed, Mina finds out her real father is a terrorist, and behind the killings. To get revenge, Mina works with British Intelligence to take him down.",1h 49min
Cure: The Life of Another,"5,4",29%,Andrea Staka,Andrea StakaMarie KreutzerThomas Imbach,"Linda and Eta, two 14-year-old girls, best of friends, retreat to a secluded beach beneath the cliffs of Dubrovnik; the morning after, only one of them returns.",1h 23min
Girltrash: All Night Long,"6,3",66%,Alexandra Kondracke,Angela Robinson,"The story of five girls and one epic night. The girls will find love, lust, girl-fights, rock and roll, and a whole lot of stoned sorority girls.",1h 26min
Glory Days,"7,5",,Roy Alfred Jr.,Roy Alfred Jr.,"Twenty years after an acrimonious break-up, rock band ""The Spiders"" are asked to re-form as the subject of a Reality Show. However, the band's original producer and songwriter is now living in Thailand, forcing the four remaining members to abandon their mundane lives, to once more pursue their quest for ""Glory Days"".",1h 49min
The Mortal Instruments: City of Heavenly Fire,"8,6",,Charles Haine,Cassandra Clare,,
O Manishi Katha,,,A. Radhaswamy,Aadi Ganesh,,
Faan se trein,"6,9",,Koos Roets,Pieter FourieKoos Roets,"He's a little slow and a little confused much of the time, but mostly he's harmless.",1h 51min
Tunnel,,,Stanlee Ohikhuare,Jumoke Olatunde,"A pastor recounts a traumatic period in his life when a Good Samaritan gesture earns him a false indictment of manslaughter, among other hapless occurrences.",
The Humbling,"5,6",53%,Barry Levinson,Buck HenryMichal ZebedePhilip Roth,A stage actor who is slowly losing his mind engages in a relationship with a sexually confused younger woman.,1h 52min
The Skeleton Twins,"6,8",86%,Craig Johnson,Craig JohnsonMark Heyman,"Habiendo ambos engañado coincidentemente a la muerte el mismo día, los gemelos separados se reúnen con la posibilidad de reparar su relación.",1h 33min
Why Do I Cry?,,,,,Complications caused by a stranger lead to dire consequences and ultimately the collapse of Natalie's world but with the help of a close friend Natalie seeks revenge.,
Naked Angel,"7,6",,Christina Morales Hemenway,Christina Morales Hemenway,A man who wants to let go of life [Duval] falls in love with an angel who longs to be human [Watkins] and is inspired to live again.,1h 50min
Katherine of Alexandria,"3,3",23%,Michael Redwood,Michael Redwood,"Constantine joins the Roman army to find his missing childhood friend. Once alerted to his friend's whereabouts, he prepares for an all out war between the East and the West.",1h 50min
From Leicester to Hollywood,"7,9",,Rhys Davies,Rod Duncan,"Rhys has given up the day job to follow his movie-making dreams. He's trying to shoot a Hollywood epic on a world-record-busting low budget. Using real events for backdrops, and the love lives of his actors for a story, he splices together something entirely new. But in film-making, as in love, things seldom go according to plan.",1h 24min
Pawn Sacrifice,"7,0",72%,Edward Zwick,Steven KnightStephen J. RiveleChristopher Wilkinson,"Durante la segunda guerra mundial, el prodigio del ajedrez Bobby Fischer se ve atrapado entre dos súperpoderes.",1h 55min
Spomenik Majklu Dzeksonu,"6,1",,Darko Lungulov,Darko Lungulov,A local barber in a small Serbian village comes up with an idea to erect a monument to Michael Jackson to attract tourists from around the world. Some locals like the idea others do not. And then we take a special Balkan ride.,1h 35min
The Drop,"7,0",89%,Michaël R. Roskam,Dennis Lehane,"Bob Saginowski se encuentra en el centro de un robo que salió mal y envuelto en una investigación que examina el pasado del vecindario, en el que amigos, familias, y enemigos trabajan para ganarse la vida a cualquier precio.",1h 46min
Princess,"6,2",57%,Tali Shalom-Ezer,Tali Shalom-Ezer,"While her mother is away from home, 12-year-old Adar's role-playing games with her stepfather move into dangerous territory. Seeking an escape, Adar finds Alan-an ethereal boy who joins her on a dark journey between reality and fantasy.",1h 32min
A Fine Step,"5,3",42%,Jonathan Meyers,Keith SuggsDennis SonnenscheinGregory Gieras,"When an expert horseman (Luke Perry) suffers a traumatic accident with his top horse, he overcomes his injury with the help of a young girl who helps rehabilitate him and the horse",1h 51min
Frank,"6,9",,Lenny Abrahamson,Jon RonsonPeter Straughan,"Jon, un joven aspirante a músico, descubre que ha mordido más de lo que puede masticar cuando se une a una excéntrica banda de pop liderada por el misterioso y enigmático Frank.",1h 35min
Effie Gray,"6,0",43%,Richard Laxton,Emma Thompson,"Una mirada al escandaloso triángulo amoroso entre el crítico de arte victoriano John Ruskin, su novia adolescente Euphemia Grey y el pintor prerrafaelita John Everett Millais.",1h 44min
Better Living Through Chemistry,"6,2",23%,Geoff MooreDavid Posamentier,Geoff MooreDavid Posamentier,"La vida sin incidentes de un farmacéutico se sale de control cuando comienza una aventura con una clienta que lo lleva a un viaje de placer que involucra sexo, drogas y posiblemente asesinato.",1h 31min
Emulsion,"6,0",83%,Suki Singh,Suki Singh,"A man becomes obsessed with finding his missing wife, drowning in the nostalgia of a 16mm home movie of her, and letting his grief gradually consume him until he gets caught up in a sinister occurrence.",1h 36min
Cesar Chavez,"6,4",,Diego Luna,Timothy J. SextonKeir Pearson,A biography of the civil-rights activist and labor organizer Cesar Chavez.,1h 42min
My Legacy,"8,0",,Helen Haig-Brown,Helen Haig-Brown,My Legacy follows Helen as she explores the often tenuous relationship between a mother and daughter made more complex by the legacy of residential school.,1h 2min
Hector and the Search for Happiness,"6,9",38%,Peter Chelsom,Maria von HelandPeter ChelsomTinker Lindsay,Un psiquiatra recorre el mundo buscando el secreto de la felicidad.,2h
When the World's on Fire,,,James Clauer,James Clauer,,
Verdades y Mentiras,,,Victor Marin,Victor Marin,"A drama about Maria whose fantasy takes into the surreal world of Cybersex, but the one night when she tries to make fantasy into reality danger lurks.",1h 20min
Missing William,"6,0",59%,Kenn MacRae,Dan McKinnon,An artist has put her own life on hold to look after her severely-injured husband; a long-lost childhood friend attempts to help her find her own life again.,1h 30min
The Prophet,"7,0",80%,Roger AllersGaëtan Brizzi(segment On Death)Paul Brizzi(segment On Death),Roger AllersKahlil GibranHanna Weg,Exiled artist and poet Mustafa embarks on a journey home with his housekeeper and her daughter; together the trio must evade the authorities who fear that the truth in Mustafa's words will incite rebellion.,1h 25min
The Last Day of Winter,,,Sergio Fabio Ferrari,Sergio Fabio Ferrari,Two young lovers are confronted with a betrayal to the Heart without cracking it open to new experiences. A Heart now dry and hard is what marks the destiny of another couple who has lost his son. Elsewhere is always a heart to give new life to a man who wants to be woman. A young priest finds that the choice from priesthood can make the heart until it split. Four sto... Leer todo,1h 22min
Million Dollar Arm,"7,0",65%,Craig Gillespie,Tom McCarthy,Un agente deportivo lanza una estrategia poco convencional para conseguir que jugadores de cricket indios jueguen para la liga de béisbol.,2h 4min
Gloria Jesus,"3,9",,Xavier Nellens,Xavier Nellens,"A young Brazilian pastor zealously pursues his mission to convert the indigenous people of the Amazon. His fervor and charisma draw the attention of the World Christ Channel, a U.S. based evangelical network methodically expanding across five continents which recruits him to be part of its team of televangelists. Emboldened by their success and momentum, the crusaders... Leer todo",1h 23min
Magic Men,"6,9",80%,Guy NattivErez Tadmor,Sharon MaymonGuy NattivErez Tadmor,"An elderly Greek man and his Hassidic rapper son embark on a journey with absurd encounters, which ultimately leads them to a final confrontation of father and son.",1h 40min
Cut Bank,"6,1",37%,Matt Shakman,Roberto Patino,La vida de un joven se desmorona después de presenciar un asesinato en su pueblo rural de Cut Bank.,1h 33min
From A to B,"5,8",,Ali F. Mostafa,Ashraf HamdiMohamed HefzyRonnie Khalil,"Three estranged childhood friends (Omar, Ramy, Jay), travel on a road trip from Abu Dhabi to Beirut in memory of their lost friend. If what happens en route doesn't make them crazy, it might just bring them closer.",1h 48min
Alongside Night,"2,9",,J. Neil Schulman,J. Neil Schulman,"Alongside Night is the story of the final economic collapse of the United States as seen through the eyes of 16-year-old Elliot Vreeland, searching for his missing Nobel-laureate-economist father, and the mysterious teenage ""Lorimer"" whom Elliot meets in a black-market underground, whose own father might be the reason Elliot's father is missing.",1h 52min
The Calling,"5,9",,Jason Stone,Scott AbramovitchMichael Redhill,La detective Hazel Micallef no tenía mucho de qué preocuparse en la tranquila ciudad de Fort Dundas hasta que una serie de horribles asesinatos en el campo circundante la pone cara a cara con un asesino en serie.,1h 48min
Six Dance Lessons in Six Weeks,"6,6",55%,Arthur Allan Seidelman,Richard Alfieri,A retired woman hires a dance instructor to give her private dance lessons at her home -- one per week for six weeks. What begins as an antagonistic relationship turns into a close friendship as they dance together.,1h 47min
PHX (Phoenix),,,Stewart Schuster,Josh NixStewart SchusterAmethyst Stark,"Explores the days of a young couple, fighting for their jobs, their house, and their lives amidst the worst recession since the Great Depression.",
Shades of Gray,"8,7",,Marco Aurelio,Marco Aurelio,A man decides to rehabilitate the murderer of his wife and children.,1h 48min
Jamesy Boy,"6,2",26%,Trevor White,Lane ShadgettTrevor White,"Un joven pandillero da un vuelco a su vida en prisión, gracias a la amistad que entabla con un asesino convicto que se convierte en su mentor.",1h 49min
The Creep Behind the Camera,"5,8",90%,Pete Schuermann,Pete Schuermann,"An exploration of the making of b-movie sci-fi cult classic ""The Creeping Terror"" and its con-man director Art ""A.J."" Nelson/Vic Savage.",1h 51min
Vampire Academy,"5,4",17%,Mark Waters,Daniel WatersRichelle Mead,"Rose Hathaway es un Dhampir, mitad humano mitad vampiro, guardián de los Moroi, vampiros mortales pacíficos que viven discretamente dentro de nuestro mundo. Su vocación es proteger a los Moroi de los vampiros inmortales y sedientos.",1h 44min
Grand Street,"6,0",,Lex Sidon,Lex Sidon,"A chance encounter between an out-of-work film executive and an aspiring writer leads to a 24 hour Manhattan odyssey through an underworld and back. Driven by hopes and dreams, steered by selfish yearnings and vague promises, Camilla and Amo's journey is mythic and fated with irreparable consequences for both. A dark romance set in New York City.",1h 21min
Semper Fidel,"8,2",,Robert Pietri,Robert Pietri,"A U.S. Marine investigates the life of his father, a Cuban sports star.",
White Dwarf,"5,6",86%,Ryan Fox,Ryan Fox,"'White Dwarf' is a blend of story and documentary that examines the culture of Hollywood when shooting stars eventually lose their luster. The film chronicles a day (and night) in the life of Gregory, a couch-surfing aspiring actor, his group of 'industry' friends and the false lives they lead.",1h 35min
Luna,"6,7",,Dave McKean,Dave McKeanAllen Spiegel,"After losing their baby, Grant and Christine visit a friend in his isolated and idyllic sea-side house. Over a long week-end, secrets are revealed and the life of the dead child is lived out in a series of fantastic dreams.",1h 46min
"Alexander and the Terrible, Horrible, No Good, Very Bad Day","6,2",63%,Miguel Arteta,Rob LieberJudith Viorst,"El día de Alexander comienza con un chicle pegado en el pelo, y a eso le siguen más calamidades.",1h 21min
Hoje Eu Quero Voltar Sozinho,"7,9",93%,Daniel Ribeiro,Daniel Ribeiro,"Leonardo es un adolescente ciego que busca la independencia. Su vida cotidiana, la relación con su mejor amiga, Giovana, y su forma de ver el mundo cambian por completo con la llegada de Gabriel.",1h 36min
Every Secret Thing,"6,1",32%,Amy Berg,Nicole HolofcenerLaura Lippman,"La detective Nancy Porter trata de resolver la desaparición de una niña en una población donde residen dos jóvenes que, siete años antes, fueron declaradas culpables de un crimen parecido.",1h 33min
Glass Chin,"5,4",86%,Noah Buschel,Noah Buschel,A down-on-his-luck former boxing champ is forced to make a choice between friendship and ambition when he is framed for murder.,1h 27min
Chambers Gate,"7,7",96%,Charles RossMukesh Asopa,Mukesh AsopaRajesh AsopaTwinkle Asopa,"Jules Akola, a newly appointed government official claims to halt rising underground street crime, namely drug lord Sydney Smalls and wingman Tio Spence. Once Tio learns Smalls is playing favorites, he regretfully employs two petty criminals, Aaron and Moor to investigate. Jules, now alleged of murder, is sought by the lovely Angie, a covert cop whose persuasive charm... Leer todo",1h 21min
Desiree,"4,7",20%,Ross Clarke,Ross ClarkeCraig Clevenger,"An inspired experimental chemist, wakes up in a New Orleans jail, accused of arson that's linked to an illegal drug-manufacturing ring. Suffering from amnesia, he's unexpectedly released on bail, determined to find his missing girlfriend.",1h 33min
Before I Go to Sleep,"6,3",37%,Rowan Joffe,Rowan JoffeS.J. Watson,"Una mujer se despierta todos los días, sin recordar nada como resultado de un accidente traumático pasado. Un día, afloran nuevas y aterradoras verdades que la obligan a cuestionar a todos los que la rodean.",1h 32min
The Lashman,"6,5",,Cameron McCasland,Cameron McCasland,"Follows a group of five teens heading off to a cabin for a ""romantic"" weekend. They are hunted down by The Lashman for being unruly teens and disturbing his peace.",1h 24min
Compound,,,Dale Stewart,Dale Stewart,,1h 46min
Bare Knuckle,"8,9",,Joel David Santner,Richard ByrneJoel David Santner,A former Marine must fight in the underground world of bare knuckle boxing in order to protect his family.,1h 10min
Supernova,"5,7",9%,Tamar van den Dop,Tamar van den Dop,"Meis is fifteen, lives in the back of beyond and aspires to a grand and stirring life, but all that happens is the passing of the time, waiting for the next car to run into the front of the house.",1h 30min
Top je bio vreo,"6,5",,Slobodan Skerlic,Slobodan SkerlicVladimir KecmanovicAles Kurt,"A grenade fired from a nearby hill kills the parents of a ten year old Serb boy during the siege of Sarajevo in 1992. The Boy looses his ability to speak. A lady neighbor adopts and takes care of him. The Boy is thrown out from his destroyed apartment and begins to prowl around the city with a schoolmate. Too early and too soon, he goes through the process of growing ... Leer todo",1h 40min
Jersey Boys,"6,8",51%,Clint Eastwood,Marshall BrickmanRick Elice,La historia de cuatro jóvenes de los suburbios de Nueva Jersey y de cómo se unieron para formar la icónica banda de los 60 The Four Seasons.,2h 14min
3.14...,"7,8",,G. Gotham Smith,Sergei KudriavtsevG. Gotham Smith,"Tres chicos se quedan sin gasolina en medio del desierto, donde se encuentran con burros mágicos, Shoshone Ghosts, cebras que escupen fuego y Hot Spring Chick (una chica con problemas de pareja recurrentes).",1h 23min
The Dark Forest,"6,9",,Michael R. MorrisHenry Luk,Henry LukMichael R. Morris,"Two lifelong friends on a mountain retreat come to terms with deception, murder and the woman they love.",1h 30min
Sabotage,"5,7",,David Ayer,Skip WoodsDavid Ayer,Los miembros de un grupo de élite de la DEA son abatidos uno a uno después de robar en un piso franco de un cártel de la droga.,1h 49min
Drummer for the Mob,,,Debby Schwartz,Frank CatanzanoRaphael E. Serebreny,"Frankie Severino is twenty-three, and a small-time band leader who works the mob-owned club circuit in Pittsburgh. He loves the night life, the sex, and performing, but he's unhappy because he can't find a nice girl with whom to settle down. He can't can't get the mob to trust him completely either. One night, he meets Toni at one of the clubs. Toni is only 17, but th... Leer todo",1h 32min
Hullo,,,David Hulbert,Shehzeen ChoudhuryDavid Hulbert,,
Plemya,"7,0",88%,Myroslav Slaboshpytskyi,Myroslav Slaboshpytskyi,"Un niño sordo ingresa en un internado para niños similares. Enfrentando travesuras violentas y criminales de los otros niños y niñas, él lucha por conformarse y unirse a ellos.",2h 6min
Lines,,,Ashley C. Harris,Ashley C. Harris,"When a hidden secret about Grace's family surfaces, she finds herself running into the arms of the high school bad boy, Danny Cross. A boy whose plans are not what they seem.",1h 15min
Pennsylvania Holy Ghosts,"7,1",,Ryan Pomeranz,Ryan Pomeranz,"Three disparate loners are forced to reflect on their direction and lives when life, death, and drugs intervene.",1h 57min
Drive-Through: The Story Movie,,,Ben Goldenberg,Ben Goldenberg,An atypical film about the art of storytelling and it's affect on daily life. A reminder that there's always two sides to every story and that things aren't always what they seem.,
The Hero,"8,5",,Luan Kryeziu,Luan Kryeziu,A war hero confronts his post war life in the new Kosovo.,1h 46min
Little Terrors,"6,1",,Maninder Chana,Maninder Chana,"A 13-year-old American boy is recruited by terrorists to bomb a U.S. embassy in Delhi. After being brainwashed he is sent to live with a Muslim family prior to the attack. However, the man harboring him begins to play a dangerous game when he attempts to convince the boy not to go through with the bombing.",1h 43min
El grito en la sangre,"7,1",,Fernando Musa,Horacio Guarany,"En algún lugar del interior de la Argentina, la creencia popular sostiene que cuando un hombre muere a traición, éste debe ser vengado por su primogénito, para que esa alma descanse en paz.",1h 39min
Persecuted,"3,5",0%,Daniel Lusko,Daniel Lusko,An evangelist finds himself framed for murder and on the run after he refuses to back a senator's proposition calling for sweeping religious reform.,1h 31min
She's Funny That Way,"6,1",45%,Peter Bogdanovich,Louise StrattenPeter Bogdanovich,"Durante los ensayos de un nuevo proyecto teatral se forma un triángulo amoroso entre una esposa, una ex-amante, y una de las actrices.",1h 33min
Stonehearst Asylum,"6,8",,Brad Anderson,Joe GangemiEdgar Allan Poe,"Un graduado de Oxford acepta un trabajo en un manicomio, solo para descubrir que los revolucionarios nuevos tratamientos son inhumanos, y que hay más de lo que parece.",1h 52min
Down the Chain,,,Sam Best,Sam Best,A man gets a chance to alter the past when he is blackmailed into stealing designs for a strange machine.,50min
50 to 1,"6,3",29%,Jim Wilson,Faith ConroFaith ConroyJim Wilson,"Based on the inspiring true story of Mine That Bird, a misfit group of New Mexico cowboys find themselves on the journey of a lifetime when their crooked-footed racehorse qualifies for the 2009 Kentucky Derby.",1h 50min
The Grim Sleeper,"5,4",43%,Stanley M. Brooks,Teena BoothRobert Nathan,Journalist Christine Pelisek helps law enforcement investigate the alleged serial killer known as the Grim Sleeper.,TV-14
Inherent Vice,"6,6",74%,Paul Thomas Anderson,Paul Thomas AndersonThomas Pynchon,"En los 70, en un Los Ángeles alimentado por las drogas, el detective privado Larry 'Doc' Sportello investiga la desaparición de una exnovia.",2h 28min
Never a Neverland,"8,3",,Ricky Norris,Elkin Antoniou G,Never a Neverland documents the reality of a kingdom moving towards extinction and the hope of a people working to ensure that Swaziland never becomes a 'Neverland'.,53min
While We're Young,"6,3",84%,Noah Baumbach,Noah BaumbachHenrik IbsenWallace Shawn,La carrera y el matrimonio de una pareja de mediana edad dan un giro completo cuando una joven pareja encantadora entra en sus vidas.,1h 37min
A Lesson of Love,"5,8",,Michael McAlexander,Michael McAlexander,A widowed teacher from Los Angeles is recruited to a small Appalachian college and falls in love with a deeply religious local woman. The unlikely love is torn apart by one's commitment to faith and the other's devotion to reason.,1h 42min
Rudderless,"7,4",64%,William H. Macy,Casey TwenterJeff RobisonWilliam H. Macy,"A grieving father in a downward spiral stumbles across a box of his recently deceased son's demo tapes and lyrics. Shocked by the discovery of this unknown talent, he forms a band in the hope of finding some catharsis.",1h 45min
City of Dust,,,Young G. Kim,Young G. Kim,"A con-man living in the slums of Kibuli in Uganda is visited by his long lost brother, who brings home a lot of uncertainty and a green plastic bag full of cash. In the next couple of days, the life of the con-man and his relationships will be changed entirely due to the money.",1h 11min
Lucia de B.,"7,0",,Paula van der Oest,Moniek KramerTijs van Marle,"A young assistant DA puts a serial killing nurse behind bars, only to discover evidence that may prove her innocence.",1h 37min
The Unlovables,,,Ilya Chaiken,Ilya Chaiken,,1h 12min
Unbroken,"7,2",52%,Angelina Jolie,Joel CoenEthan CoenRichard LaGravenese,"Después de un accidente aéreo casi mortal en la Segunda Guerra Mundial, el olímpico Louis Zamperini pasa 47 días en una balsa con dos compañeros de tripulación antes de ser capturado por la marina japonesa y enviado a un campo de prisioneros de guerra.",2h 17min
The HR Guy,,,Benjamin Mathews,Ben Tannous,"When Phil meets the new HR guy from work at a Corporate bar one morning, the HR guy is feeling guilty about having to let someone go. Phil takes it upon himself to teach him a thing or two about firing people and the ruthless reality of the business world .. But Phil's in for a surprise ..",
Annie,"5,3",49%,Will Gluck,Will GluckAline Brosh McKennaThomas Meehan,Una niña huérfana que vive con una mala madre de acogida ve su vida cambiar ante sus ojos cuando un magnate de los negocios con intención de ganarse el puesto de alcalde de Nueva York la adopta.,1h 58min
Tainted Rose,"8,0",,Tony Villalobos,Tony Villalobos,,1h 34min
Pierrot Lunaire,"4,8",,Bruce La Bruce,Albert GiraudOtto Erich HartlebenBruce La Bruce,"A young girl that regularly dresses as a boy falls in love and seduces a young girl that has no clue that her lover has the same sex. When the girl introduces 'her boyfriend' to her father he becomes skeptical and unmasks the fraud. Even though, strangely, the feelings of the girl persist without shifting, the father does not allow them to ever see the other again. Fu... Leer todo",51min
