Nombre,Puntuacion_IMDB,Puntuacion_Rotten_Tomatoes,Director,Guionistas,Argumento,Duracion
Red Tails,"5,9",40%,Anthony Hemingway,John RidleyAaron McGruderJohn B. Holway,"Un grupo de pilotos afroamericanos en el programa de entrenamiento de Tuskegee, que se enfrentaron a la segregación mientras permanecían sobre el terreno durante la Segunda Guerra Mundial, son llamados al servicio bajo la dirección del Coronel A.J. Bullard.",2h 5min
Making Change,"7,2",,Wesley Wittkamper,Wesley Wittkamper,"This movie is based around the true story of the homeless newspaper, ""Making Change"". It is about a group of societies' dropouts who take up the fight against a government that wants to make criminals out of private citizens, and churches who feed the starving. It sheds light on new controversial legislation that outlaws giving food away in public, suppresses religiou... Leer todo",1h 34min
A Thousand Words,"5,8",0%,Brian Robbins,Steve Koren,"Después de estirar la verdad en un trato con un gurú espiritual, el agente literario Jack McCall encuentra un árbol Bodhi en su propiedad. Su aparición contiene una valiosa lección sobre las consecuencias de cada palabra que pronuncia.",1h 31min
The Attack,"7,1",,Ziad Doueiri,Joelle ToumaZiad DoueiriYasmina Khadra,Un cirujano Palestino que vive en Tel Aviv descubre un oscuro secreto sobre su esposa después de un atentado suicida.,1h 42min
Belle du Seigneur,"5,0",27%,Glenio Bonder,Glenio BonderVincenzo CeramiAlbert Cohen,Un funcionario de alto rango judío tiene un romance con la esposa protestante de uno de sus empleados.,1h 44min
Jack & Diane,"4,4",15%,Bradley Rust Gray,Bradley Rust Gray,Diane's feelings for Jack -- the girl she met over the summer -- begin to manifest themselves in terrifying ways when she learns that her friend will soon be moving away.,1h 45min
Folie à deux,,,Sean Martin,Nicholas Mark HardingSean Martin,"Lucas and Cleo meet online and then meet for real. They spend the afternoon together, talking, hanging out, meeting an oddball assortment of people along the way. Only in the final minutes of the film does the reason for their meeting become apparent...",
The Sweeney,"6,1",45%,Nick Love,Nick LoveJohn HodgeIan Kennedy Martin,"Adaptación de una serie británica de los 70, que sigue la historia de una pareja de policías de Londres, el detective Jack Regan y su leal compañero George Carter.",1h 52min
Evangelion Shin Gekijôban: Kyu,"6,9",,Mahiro MaedaMasayukiKazuya Tsurumaki,Hideaki AnnoYôji EnokidoMahiro Maeda,"Han pasado catorce años desde el casi tercer impacto. La mayor parte del mundo ha cambiado, excepto Shinji Ikari, quien despierta en un entorno nuevo y extraño sin haber envejecido.",1h 36min
Letting Go,"6,3",100%,Jake Torem,Jake Torem,"Unlucky in love, strangled at work, and tormented at home, Joel Slater is desperately searching for a way to juggle his life. But sometimes, the secret to happiness begins with letting go.",1h 23min
Exposed,"6,0",,Burke HeffnerShashi Balooja,Shashi BaloojaCaytha Jentis,You're ambitious and want to be a player in the New York City political arena. Be careful what you wish for.,1h 22min
White Men Can't Dance,"3,3",,Pete Vinal,Pete Vinal,A middle-aged father loses his job. He decides the best solution to pay for his daughter's operation is to secretly enter a dance contest thus causing his wife to suspect he's having an affair.,1h 45min
Hitchcock,"6,8",60%,Sacha Gervasi,John J. McLaughlinStephen Rebello,"Explora la relación entre Alfred Hitchcock y su mujer Alma Reville en 1959, durante el rodaje de ""Psicosis"".",1h 38min
Four,"5,9",75%,Joshua Sanchez,Christopher ShinnJoshua Sanchez,"On a hot 4th of July night, sparks fly between four people as they test the limits and possibilities of their own freedom.",1h 15min
The Courier,"4,5",85%,Hany Abu-Assad,Brannon CoombsPete Dris,"Un millón de dólares solo por entregar un maletín ... Es un trabajo demasiado bueno para ser verdad, especialmente si eres El Mensajero, un portador temerario reconocido por asumir misiones imposibles que nunca se ha fallado una entrega.",1h 35min
Kokomma,,,Tom Robson,Uduak Isong Oguamanam,,
Zeit der Olive,,,Mehmet Coban,Mehmet Coban,,
The flowers at the window,,,,,"Some girls of Cameroon, use Internet for to met a white man. They are not only at the window/frame of the webcam or digital camera, but also of their young lives. Beyond the window they observe the north of the world, where they send, or from where they receive, messages, see men pass through, hoping that is one that will help them come down from their window to help ... Leer todo",1h
"Mamo, ya lotchyka lyublyu","6,7",,Aleksandr Ignatusha,Vera Melnik,,1h 30min
Midnight Party,"3,4",,,,Young woman invite her friends to her villa and when all of them arrive she locks them inside and starts questioning them about betraying her trust.,1h 30min
After the flood,,,,,,
Das Ewige Antlitz,,,Markus Selg,Markus Selg,"Since he took his father's death mask he has stopped carving. The sculptor, guided by an internal voice, must leave. He departs from his Bavarian village and family, who belong to an indefinite past, and sets off for Prague. On his journey he has visions: Tadpoles squirming in a puddle, a worm writhing in agony, a flying eagle attacking a swan and a dreamlike masked p... Leer todo",1h 40min
Vinmeengal,,,Vignesh Menon,Vignesh Menon,Based on a true life incident revolving around the life of a physically challenged protagonist.,2h 35min
Du shi tong hua,,,Ming Liang,Li Li,,
My Avatar Horse,,,,,,
Block Burner,"7,6",,Chad Hendricks,Young Block,"The story of Young Block. Born in the hood. Never knew his father. Mom's boyfriends abuse her. Grows to hate all men. Learns dope game. Homeless. Lives with a baser. Robs to eat. Gets shot at. He shoots back. Finds love. Finds a best friend. They cheat on him. He cant trust anyone. Back to the dope game. How many chances do you get in life? When you burn the block, th... Leer todo",1h 39min
Argo,"7,7",,Ben Affleck,Chris TerrioTony MendezJoshuah Bearman,"Actuando bajo la tapadera de un productor de Hollywood que busca una localización para una película de ciencia ficción, un agente de la CIA pone en marcha una peligrosa operación para rescatar a seis estadounidenses en Teherán.",2h
Nochoice,,,,,,54min
Last Days In Waldo County,,,Matt Enos,Matt Enos,"Independent narrative/pseudo-documentary shot in Waldo County, Maine, between the years 2010 and 2012. An experiment in white trash excess and violence.",45min
Daisy,,79%,Benjamin Wilkinson,Benjamin Wilkinson,Two Sisters. Two Stories. One Truth.,1h 19min
Everyday,"6,2",,Michael Winterbottom,Laurence CoriatMichael Winterbottom,"This film charts the relationship between a man imprisoned for drug smuggling and his wife and is being shot over the course of five years, a few weeks at a time.",1h 46min
The Story of Luke,"7,1",83%,Alonso Mayo,Alonso Mayo,"Sheltered by his grandparents, Luke, a young man with autism, is thrust into a world that doesn't expect anything from him. But Luke is on a quest for a job and true love. And he isn't taking no for an answer.",1h 36min
Silver Linings Playbook,"7,7",92%,David O. Russell,David O. RussellMatthew Quick,"Tras pasar un tiempo en una institución mental, el exprofesor Pat Solitano vuelve a casa de sus padres e intenta reconciliarse con su exmujer. Las cosas se complican cuando conoce a Tiffany, una misteriosa chica con sus propios problemas.",2h 2min
Song for Marion,"6,9",66%,Paul Andrew Williams,Paul Andrew Williams,"El jubilado gruñón Arthur honra la pasión de su esposa fallecida al unirse al coro al que ella solía pertenecer, un proceso que lo ayuda a construir puentes con su hijo separado, James.",1h 30min
Saad,,,Hemant Dabhade,Anand Mhasvekar,"Rahul is an executive who lives with his parents in Malaysia. He finds love in Sarika (Avantika Salian) who has been deputed for 4 months in his office. After a few months Rahul gets promoted and is given the option of moving to US or India. To appease his mother, he chooses to move to USA but an incident takes Rahul back to India in search of his biological mother, R... Leer todo",
The Bird Who Saved the World,,,Bo-Han ChiuArthur Tsou,Bo-Han ChiuArthur Tsou,"Wei plays an aspiring singer who is at a crossroads, wondering whether to pursue his career as a musician. At this difficult time, a giant bird enters his life, giving him a new perspective in assessing his future. This fantastic creature, the nature of whose existence we are free to speculate about, builds a strong relationship with the central character, but begins ... Leer todo",1h 24min
Nasilje-Mreza-Resenje,,,,,,
This Bitter Earth,"6,3",,David Lee Rawlings,David Lee Rawlings,"A teen piano prodigy suddenly quits the keyboard after personal tragedy strikes at home. With the help of an eccentric former blues singer with a hidden past, she must rediscover her desire in time for an all-important talent competition.",1h 16min
Kuroinu: Kedakaki Seijo wa Hakudaku ni Somaru,"7,6",,Ouji HakudakuAyano Kunio,Izumi Ban'yaAsou EiYatsude Romu Ko,,2h 32min
Murder,,,,,,
Blitz and Bananas,,,Anna Littler,Anna Littler,A touching film set in 1940 at the height of World War 2 in the town of Bromley telling the stories of the residents of the town.,1h 37min
Espacio interior,"6,7",56%,Kai Parlange Tessmann,Pierre Favreau AlcázarVicente LeñeroKai Parlange Tessmann,"Encerrado y aislado, siempre bajo amenaza, por primera vez Lázaro entiende que es un hombre libre.",1h 29min
Shabnam and Shafaq,,,Fawzia ArianHamed Arian,Sutara ArianFawad Yaqob,,2h 30min
The Dark Side of Love,"3,9",,Jorge Ameer,Jorge Ameer,"Two brothers on different life paths, a waiter with a crush on an eligible bachelor and a drug addict in a twisted dependent relationships with his girlfriend, reunite to mourn the death of their mother.",1h 27min
Ardhanaari,"4,6",,Santhosh Souparnika,Santhosh Souparnika,"The life and struggles of Manjula/Vinayan, a transgender person in Kerala.",1h 35min
Un cuento Latinoamericano,"5,3",,Juan Manuel Rampoldi,,"In the 40s, during the government of General Perón, a strange experiment was held in Argentina. The purpose was to create a new Latin American ideal society. But that experiment ended abruptly and all involved were exterminated. The first to be burned at the stake were prostitutes that the General had implanted to keep men encouraged and the new society in perfect bal... Leer todo",1h 28min
"0,40%",,,Fabian García Gutiérrez,,,
Orkut Oru Ormakoot,,,Manoj KumarVinod Kumar,Manoj KumarVinod Kumar,,
Shakhta,"4,2",,Nurbek Egen,Oleg Timoshishin,,
Bokad,,,Pravin Raja Karale,,A group of college students from Mumbai arrive in a village for a field trip.They realize that how different their city life is from the village life.The events take a turn when a high priced Goat of the village Sarpanch goes missing .,2h 8min
Between Us,"4,7",,Dan Mirvish,Joe HortuaDan Mirvish,"Two couples reunite over two incendiary evenings where anything can happen in this darkly comedic story of best friends, marriage, love, disappointment and dreams.",1h 30min
History Rediscovered: The Secret Life of Adolf Hitler,,,,,,52min
Driving Me Crazy: Proof of Concept,"6,3",,Steve Marshall,Keith BlackMark Troy,"This was produced to show, in concept, the style and tone of a full feature movie and aiming to showcase the comedy aspects of the final production.",
"Ja som baník, kto je viac...",,,,,"A happy and worry-free young person on the periphery of Slovakia receives a gift from his father on his eighteenth birthday - a job in the mines. This triggers a series of situations in which he tries to avoid this traditional work and searches for various other opportunities. His efforts are, however, in conflict with the character of the environment and the social o... Leer todo",51min
Hard Man,,,Mark G. Wood,Mark G. Wood,"A Texan ravaged by alcoholism encounters some of his biggest struggles when his estranged daughter decides to place him in a nursing home. Distraught at his daughter's decision, he becomes angrily determined to die at the ranch rather than the nursing home. He is then forced to work with a considerate caretaker, encountering Texas-sized drama along the way.",1h 20min
Kalua Bhail Sayan,,,O.P. Kashyap,,,
Antim Tandav,,,Dilip Sharma,,,2h 15min
Winou Baba?,"8,2",,Jilani Saâdi,Jilani Saâdi,"ONS refuses to attend her own wedding with HALIM, her husband to be, experiences this as a great injustice and shame. He locks himself in his house a few days then decides to abandon his social life to join a group of marginalized. Punished and locked up by her parents, they managed to escape to roam the city. HALIM and ONS find themselves in this life of wandering. W... Leer todo",1h 30min
Art of Submission,"3,9",,Adam BosterKenneth Chamitoff,Kenneth Chamitoff,"This full-contact action drama, loaded with authentic mixed martial arts, is a transcending inspirational story of redemption.",1h 59min
Devra Pe Manva Dole,,,Premashu Singh,,,2h 1min
The Girl,"6,2",,David Riker,David Riker,A young Texan mother who loses her child to foster care begins smuggling Mexicans across the border.,1h 35min
Zug O Pered,,,Tommy Lang,Tommy Lang,"Peter, freshly widowed at 60, is looking for a new relationship. His son, Rami, finds solace in smoking weed. Peter meets 50 year old Noga, who has a daughter named Nelly. We watch the relationships unfold between the four characters.",1h 34min
Lay the Favorite,"4,8",18%,Stephen Frears,D.V. DeVincentisBeth Raymer,"La ex bailarina privada Beth aspira a ser mesera de cócteles en Las Vegas cuando se enamora de Dink, un jugador de deportes.",1h 34min
Il muro celato,,,,,,1h 30min
Frankenweenie,"6,9",,Tim Burton,Leonard Ripps(1984 screenplay)Tim BurtonJohn August,"Cuando el querido perro de un niño muere repentinamente, intenta devolverle la vida al animal mediante un poderoso experimento científico.",1h 27min
Perfection,"6,6",,Christina Beck,Christina Beck,"Kristabelle, still living with her Mother cuts herself to feel alive. Her Mother, addicted to plastic surgery also cuts herself trying to maintain her youth. Through the help of a pot smoking young lover, a newly sober British stand up comic and Chinese medicine they all find that love can be more than skin deep.",1h 25min
Old Gold Time,,,,,"England, 1942. London is under attack. Two lovers got separated by the WW2. 50 years later, by chance they found each other. Things started to get complicate for this new relationship, as they are not as sweet as they remembered each other. A funny, dry romance comedy.",
Mountain Mafia,"5,9",,Cherokee Hall,Cherokee HallReaper M. JonesCasey Miracle,"In the rolling landscape of Appalachia, beauty resides within each valley and atop the crest of each hill. It is the land of bluegrass, horses, coal mines, and tobacco. Under the surface of this delicate veneer, a treacherous underbelly lies. A world stricken with drugs, guns, money, and the Mountain Mafia rules all. Shortly after the passing of his mother and meeting... Leer todo",
Harold & Lorna: World Water Speed Champions,,,William Plumstead,William Plumstead,"The almost-forgotten exploits of Harold and Lorna Wilson, who raced their Miss Canada boats into international fame, broke the worldwide water speed record, and made Canadians proud and racing fans everywhere stand up and cheer.",1h 20min
Ron and Justin,"4,8",,Mark Livingston,Mark Livingston,,2h 20min
Judge Zhan,,,Ling Dong,Min CuiDanrui DongLing Dong,,
Tang Ka,,,Chaolu Hasi,Huiqun Tian,,
Wu Ren Bao,,,Geng Xu,Yu TangGeng Xu,,1h 50min
I Swan,,,Sheng Kong,,,1h 33min
Broken Kingdom,"5,4",77%,Daniel Gillies,Daniel Gillies,"Four narratives weave their way through the tragic slums of Bogota to the lofty hills of Hollywood. A 14-year-old prostitute girl and an ill-fated, eccentric American writer forge a strange companionship. A Colombian university student invites a terrible danger into her world in the name of financial solace, while a day-care teacher in Los Angeles does everything she ... Leer todo",
Mopireul ipeun bineoseu,"2,9",,Ye-sup Song,Leopold von Sacher-MasochYe-sup Song,"Film director Hyun meets a mysterious woman and asks her to be his muse. Intrigued by his daring proposal, she accepts. Soon she invites him to her home to give him some secluded space to write his guide.",1h 20min
Cheerful Weather for the Wedding,"5,6",37%,Donald Rice,Mary Henely-MagillDonald RiceJulia Strachey,"A young woman frets upstairs in her family's country manor on her wedding day, fearful she's about to marry the wrong man. Downstairs, her fiancé and her former lover grow increasingly anxious.",1h 29min
Kosmische Puppen III,,,Cosmotropia de Xam,,,
Where Is Joel Baum?,,,Pearl Gluck,Pearl Gluck,,
18++: Forever Love,"7,6",,Nayato Fio Nuala,,,1h 22min
Hello Cô Ba,"4,7",,Nguyen Quang Minh,Thach Tuyen,,1h 30min
Gapos,,,John Valdes Tan,Gilbeys Sardea,,53min
Ardham Chesukoru,,,Ravi Mulakalavalli,,,
Colegas,"6,5",83%,Marcelo Galvão,Marcelo Galvão,"Three young people with Down syndrome decide to run away in search of three simple wishes: Stalone wants to see the sea, Aninha looks for a husband and Marcio needs to fly.",1h 34min
Easy Rider: The Ride Back,"2,4",23%,Dustin Rikert,Phil PitzerDustin Rikert,"Drama familiar a través de décadas sigue al clan Williams, unidos por pasión motociclista. Sus conflictos internos desde los 40 hasta hoy, sin análisis.",1h 39min
"Jelena, Katarina, Marija","5,1",,Nikita Milivojevic,Dusan MikljaNikita Milivojevic,"Three young women from Belgrade, Jelena, Katarina and Marija, meet by accident in New York City. Each has her reasons for leaving Belgrade: Katarina left in the mid 90s in search of a better life, Jelena fled the bombing in the late 90s... Marija's boyfriend, whom she was going to marry, was killed in the war, prompting her to leave the country for good.",
The Door,"6,4",,István Szabó,Magda SzabóIstván SzabóAndrea Vészits,An author forms a strange bond with her eccentric maid that will have a lasting effect on both women.,1h 37min
Gajoksinema,"7,0",,Sung-ho Kim(segment In Good Company)Ji-Yeong Hong(segment Star Shaped Stain)Soo-youn Lee(segment E.D. 571),Jong-nam Chu(segment In Good Company)Ji-Yeong Hong(segment Star Shaped Stain)Ha-Yong Jung(segment In Good Company),,2h 5min
Murattu Kaalai,"5,3",,K. Selva Bharathy,K. Selva BharathySp. Muthuraman,"Kaalaiyan (Sundar C) is a simple person and the best Jallikattu (Bullfight) player in his village. His world revolves around his four younger brothers. The antagonist is Varadharajan (Suman), a Zamindar from the neighboring village who lives an extravagant lifestyle. His close aide is a transgender Saroja (Vivek). Varadharajan's sister Priya (Sindhu Tolani) falls for ... Leer todo",2h 16min
Middle of Nowhere,"6,6",88%,Ava DuVernay,Ava DuVernay,"Cuando su esposo es sentenciado a ocho años de prisión, Ruby abandona la escuela de medicina para concentrarse en el bienestar de su esposo mientras él está encarcelado, lo que la lleva a un viaje de autodescubrimiento en el proceso.",1h 41min
Lawless,"7,2",,John Hillcoat,Nick CaveMatt Bondurant,"Ambientada en el condado de Franklin, Virginia, en la época de la Depresión, un trío de hermanos contrabandistas se ve amenazado por un nuevo agente especial y otras autoridades que pretenden obtener una parte de sus beneficios.",1h 56min
Love Virtually,"5,9",87%,,,,45min
Retazos,,,Cristian Genovés,Cristian Genovés,,
Joint Enterprise,,,Birger Larsen,Robert Jones,,1h
Silencios Rotos,,,Álex López,Toni AlemanyÁlex López,"A student decides to investigate her family's past for a job, unaware that the investigation will bring numerous post-war murders to light.",1h 35min
Dropping Evil,"3,0",57%,Adam Protextor,Louis Edward Doerge,"After his friends slip him LSD on a camping trip, ultra-nerdy Nancy hallucinates that they are evil beings and begins to systematically hunt them down. Meanwhile, a mysterious corporation monitors the entire event for their own hidden purpose.",1h 22min
Dust,"6,9",,Drew Maxwell,Drew Maxwell,"An Alien virus is unleashed on Earth, mutating millions into carnivorous beasts. Scientist Nick Richards, and a hard nosed team of survivors wage a losing battle against the alien force, desperately trying to restore Human life.",2h
Akalted Ghiri,,,Mustafa Boukertas,Fakhar Bakir,,
Nightfall,,12%,Seven King,Seven King,,
A Late Quartet,"7,1",77%,Yaron Zilberman,Yaron ZilbermanSeth Grossman,"Los miembros de un cuarteto de cuerda de renombre mundial luchan por mantenerse unidos frente a la muerte, los egos enfrentados y una lujuria insoportable.",1h 45min
You Can't Go Back,,,Roosevelt Jackson,Roosevelt Jackson,"The story of a young man, Andre (Michael Eli Wilson) who returns home and soon finds out no matter what he does to better his life, You Can't Go Back. Once he see things are not like it was, he must now decide what to do with his life even after he finds out news that may change the direction he has chosen to travel.",
Shadows of Life,,,Anthony M. Laura,Anthony M. Laura,A young girl grapples with her sexual awakening while her mental health unravels.,1h
Not Fade Away,"6,0",,David Chase,David Chase,"Ambientada en los suburbios de Nueva Jersey en la década de 1960, un grupo de amigos forma una banda de rock y trata de triunfar.",1h 57min
Mit O Szarym,,,Grzegorz Królikiewicz,Grzegorz Królikiewicz,,
Café amargo,,,Rigoberto Jiménez,Arturo ArangoXenia Rivery,,1h 30min
Red Dawn,"5,3",50%,Dan Bradley,Carl EllsworthJeremy PassmoreKevin Reynolds(1984 screenplay),Un grupo de adolescentes intenta salvar a su pueblo de una invasión de soldados norcoreanos.,1h 33min
Clear Lake,"6,5",,Mick Paulusma,Mick Paulusma,"A young man, trapped in a dead-end life caring for his over-protective father, is offered a second chance to fulfill his boyhood dream. Taking it will change everyone he loves forever.",1h 25min
Milo,"6,5",33%,Berend BoorsmaRoel Boorsma,Berend BoorsmaRoel BoorsmaHeather Imani,"Milo, an isolated 10-year-old boy with 'sensitive skin', lives a life rigidly controlled by his father. Sparked by his first friendship, he runs away from home to attend the school camping trip - but never arrives. He falls into the hands of an ageing criminal couple, with whom he enjoys pure freedom from constraint - until he learns the shocking truth about his skin ... Leer todo",1h 34min
Amanti,,,Paulo F. Garcia,Enriques Paorths,"A group of notables meets to tell their life; how it was, how it happened, the satisfactions and disappointments.",2h
Mulher à Tarde,"3,6",,Affonso Uchoa,Affonso Uchoa,Three women in a house. For an afternoon. The film follows the daily lives of three young women who live together in a large city in Brazil and are going through crucial moments in their lives.,1h 10min
Last Summer for Boys,,,Nathan Anderson,Nathan Anderson,,
Nan guen he bian de nu ren,,,Zhijun Han,Zhijun Han,,1h 30min
Wo yao hui jia,,,Yi Nan,,,1h 42min
LAID: Life as It's Dealt,"6,8",,Andrew RodriguezJ.D. Stimson Jr.,J.D. Stimson Jr.Andrew Rodriguez,"A young male escort falls for the ""girl next door"", only to find himself caught between two colliding worlds.",1h 45min
Aandhi Toofan,,,Ravi Bhushan,Ravi Bhushan,,2h 38min
Bridge of Names,"4,0",,Elizabeth FoleyPeter J. Hobbs,Elizabeth FoleyPeter J. Hobbs,A traveling guitarist is looking for a town named Brandy; meeting strange new people along the way.,1h 35min
Watching TV with the Red Chinese,"5,8",40%,Shimon Dotan,Netaya AnbarShimon DotanLuke Whisnant,"In New York City in 1980, Dexter Mitchell plays half-willing big brother to his neighbors, a trio of exchange students from the People's Republic of China.",1h 45min
In the Gray,"6,5",,Rob Holloway,Rob HollowayLee Arenberg,"Undercover narcotics officer Yancy is always faced with complicated decisions when it comes to his work, but the lines become blurred when other factors now come in to play. His life and work slowly intertwine and what was once the clarity he knew is now an alternate reality. As he falls for one of his targets and begins to use in order to save his cover and ultimatel... Leer todo",2h 2min
Small Apartments,"6,1",30%,Jonas Åkerlund,Chris Millis,A man is surrounded by strange events and odd neighbors in this adaptation of Chris Millis' novel.,1h 36min
USS Seaviper,"2,4",10%,Ralph A. Villani,Lynanne Rockhill,"El submarino alemán, U-234, del puerto de Kiel está intercambiando carga con los japoneses. USS Seaviper debe localizar y detener este peligroso intercambio.",1h 42min
Looper,"7,4",93%,Rian Johnson,Rian Johnson,"En 2074, cuando la mafia quiere deshacerse de alguien lo envía al pasado, donde le espera un sicario, como Joe, que un día se entera de que la mafia quiere cerrar el círculo enviándole de vuelta a su yo futuro para asesinarle.",1h 59min
En kongelig affære,"7,5",,Nikolaj Arcel,Bodil Steensen-LethRasmus HeisterbergNikolaj Arcel,Una joven reina que está casada con un rey loco se enamora secretamente de su médico y juntos inician una revolución que cambia una nación para siempre.,2h 17min
Dixie Times,"9,0",,Sherrie ProvenceKen R. WheelerStacey Turner,Ken R. Wheeler,"A moonshiner turned sheriff's deputy helps bring in the bad guys armed with duct tape. The local newspaper reporter now has some major events to write about, and a sleepy little Alabama farming community is making the news all over Dixie.",1h 38min
Bingxue 11 tian,,,Guoxing ChenXiaolie Wang,Xiaowei Su,,1h 40min
Sorairo monogatari,,,,,,
Kaleidoscope,"8,1",85%,Avital Ash,Avital Ash,"Anna plans to commit suicide on her 21st birthday, but is interrupted by her best friend's surprise visit. The day takes a turn when an impromptu birthday party begins.",1h 23min
Roulette,"4,0",,Erik Kristopher Myers,Erik Kristopher Myers,"A deadly game of Russian Roulette, one last session of group therapy.",1h 53min
