Nombre,Puntuacion_IMDB,Puntuacion_Rotten_Tomatoes,Director,Guionistas,Argumento,Duracion
Aitebaar,"6,2",,Kashif Saleem,Mansoor Saeed,Newly weds Ahmed and Shama are still learning the intricacies of a married life when Shama's sister Uzma and Ahmed's friend Rajab intervene posing as relationship experts. Soon it becomes clear that something is not right.,1h 20min
The Perfect Mistress III.,,,Magdolna Cecília Eröss,Mario LagóMiron Manega,,
Tu Mera Chaand,,,Syed Muhammad Khurram,Faysal Manzoor Khan,"Nani and Dadi's close-knit family suffers some financial constraints. And with two unmarried granddaughters, their future appears bleak. But all is about to change when their brother-in-law calls to informs them that his son Ali, is visiting Pakistan to look for a life mate! Originally aired on GEO Entertainment in Pakistan. This is an Urdu language tele-film with Eng... Leer todo",1h 12min
Le Blu,,,Guillermo Rovira,Guillermo Rovira,,
[S.O.S] Sói Trang,,,Hoang Le,,,1h 44min
14 Tirmeh,"3,9",,Hasim Aydemir,Ilham BakiIlham BakirMehmet Emin Engizek,"In September 12 1980, Turkish state carries out a military coup suppressing struggle of Kurds for human rights and freedom.",2h 26min
Zombe,,,Eden Limchawalit-Smith,Eden Limchawalit-Smith,,48min
Kinbaku: Tsuki no Shô,"6,1",,Naoyuki Tomomatsu,,A woman hires a specialist to use rope torture on a woman she blames for her husbands death.,1h 10min
How Are You,"5,0",,,,"High school all-rounder Han Meimei develops a crush on Li Lei, a boy who has blossomed upon graduation. Will fate bring the two together?",1h 28min
Rangeela (telugu),,,Rockeshh Reddy,Rockeshh Reddy,,1h 30min
Sunyo Theke Suru,,,Tutul Banerjee,Tutul Banerjee,"Sunyo Theke Suru is a social drama that is based on the life and struggles of our main protagonist Paresh Bannerjee. Hailing from a simple family in the outskirts of Bengal, Paresh has big dreams of making it big in life in the Fil Industry. Talented, honest and very hard-working, Paresh filters through menial jobs and runs errands for several employers to make his lu... Leer todo",
Cesare,,,Louis Rogers,Louis Rogers,,47min
Crima si pedeapsa,,,Jon Gostin,Jon Gostin,,
Terminal Behavior,,,Grady Weatherford,Jeffrey HallJohn Williamson,"A breakdown in security at Roosevelt Airport leads to two terrorists being able to bring down a commercial flight. In this gripping interactive movie, you must go back in time one week to make different choices as four very different airport employees to try and prevent the tragedy.",3h
Camping,,,,,,
O Pilla Nee Valla,,,Kishore Kumar Reddy Sonti,Kishore Kumar Reddy Sonti,,
Cent anys després,,,Marcos CabotáElisabeth Moll(co-director documental),Marcos Cabotá,,
Only the Wind Knows,"5,3",,Tian Han,,,1h 52min
GEN Hi8,,,Miguel Miyahira,Miguel MiyahiraFernando Ureta,"Early 1990s, Diego, a 15 year-old teenager, is the ""New kid in town"" in a Peruvian middle-class neighborhood. Diego tries to fit in a group of friends, some of them older than him. In the middle of the country's situation,convulsed by subversive terrorist attacks, military actions, social disconcert and political instability, Diego has to develop his identity, influen... Leer todo",
The Preparation,"8,1",,Young-Jun Cho,Young-Jun Cho,A mother who has been diagnosed with terminal cancer prepares her mentally disabled son for her inevitable passing.,1h 54min
Youth Dinner,"6,6",,Yuan Li,Feng MeiSiyang Zhang,"Young blood Ding Chenggong comes across cool beauty Lin Xiaolan during a youth war in plant area. Both two fall into dark feelings with each other. At the same time, Ding'a single father and Lin's single mother fall into their middle age of love. Along with two families' regular dinner for six, young Ding and Lin start to experience their flappy and pathetic love.",1h 37min
A Stray Goat,"6,1",,Jae Min Jo,Jae Min Jo,"En un antiguo pueblo ubicado en la provincia de Gyeongsang, en la región sureste de Corea, Nunbal, dos estudiantes de secundaria entablan una extraña y poco común amistad.",1h 31min
Seita,,,Lauri AutereAleksi Soukka,Tuukka KuruRami Tammenoksa,,1h 51min
The Artist: Reborn,"6,1",,Kyoung Won Kim,Kyoung Won Kim,"Gisele, a not so popular artist, gains fame after meeting a cunning and canny art sales representative Jae-bum. As she is ready to bathe in her success, she unexpectedly dies of reasons unknown, and Jaebum takes this.",1h 36min
The Eighth Day of the Week,"7,8",,,,"Jiang Wei (Wang Yi Miao & Ba Guan Jin), a big girl who was nothing, accidentally got the magic bracelet and got the ""week 8"" time. However, the bracelet was stolen and all falsehoods were successfully defeated. Jiang Wei finally understood that the meaning of magic is growth rather than pretense.",1h 35min
"Havana, Habana","6,4",,Claude Brickell,Claude Brickell,"Set in Havana during the Castro revolution, the story of an affair between an American heiress and a Cuban Army lieutenant, opposites thrown together by circumstances, who shared the same lover several years before.",1h 5min
Nuestro silencio,,,Alvaro Ruiz,Alvaro Ruiz,,1h 23min
Omar Al Azrak,"2,7",,Ehab Abdellateef,,,1h 50min
Aisylu,,,Rustam Rashitov,Aleksey Barykin,Aisylu is a young woman from a Tatar village who had an accident as a child and now walks only with crutches. Once a popular music producer from the capital bet that he would make Aisylu a pop star.,
Wives on Strike: The Revolution,"6,1",,Omoni Oboli,,"After a woman is beaten to death by her husband, her friends gather to take a stand against horrible injustice.",1h 34min
Atenas,"6,8",,César González,,Can the will crush all anthropological suspicion? Can desire only invent a path? Is it possible to escape from the basement of the world?,1h 16min
Undying Youth,,,,,,
I'm Rising,,,Rajesh Bajaj,,"Aspiring to win a reality show, a young girl meets up with her high school friends for an evening, to seek their help. but her innocent dance rakes up a hidden past and she disappears without a trace.",
Roehampton Guerrillas (2011-2016),,,,,,2h 7min
Uur Tsaigaasai (In the Dawn),,,Janchivdorj Sengedorj,Battushig AmarsanaaJanchivdorj Sengedorj,"A recently widowed affluent woman, Undral, faces an inevitable challenge when she must bring her late husband's former wife to the city from the countryside.",1h 59min
Match,"3,5",52%,Alhmoudi Obaid,Albbas Rayan,two brothers whose lives are torn apart by the murder of their father. Match follows the different paths taken by the brothers after the death and the consequences that come from their actions.,
Shattered Waves,"7,4",,Habib Mestiri,Abdelfattah FakhfakhHabib MestiriAli Saidane,"Hassouna, an officer in the french army, is committed to the cause of independence of his country. In disregard of the risks, he transmits information to the independence activists' networks. Once he discovered a list of Tunisian betrayers, he faces rejection and persecution.",1h 30min
Father. Mother. Me.,,,,,,1h 15min
Blood Brothers,,33%,,,,
This Is You,"7,4",,Rankin Dean,Rankin Dean,,1h 36min
The Great Leader,"2,3",,Abhishek ChadhaAbhishek Chhadha,Abhishek Chhadha,,
Transgression,"4,2",,Val Todorov,Val Todorov,"La joven Yana es el cebo en una tertulia televisiva en la que confiesa su inusual relación con un rockero entrado en años, resultando en una persecución a manos de un grupo de cazadores vigilantes y otras complicaciones.",1h 39min
Circle of Fire,,,Ugezu J. Ugezu,Ugezu J. UgezuVera C. Uzokwe,,
Dark,"6,1",,Paul Schrader,Haider I. MohsinPaul Schrader,Un agente del gobierno debe localizar y matar a un terrorista antes de perder la memoria por completo debido a la demencia.,1h 15min
Evolution,,,Deeptanshu Sinha,Deeptanshu Sinha,,
A Lonely lane,,,Vincent D. Anointed,Alexander BenVictor IykeStanley Nweze,"A young man discovers he is Hiv positive, this lead to his friends cutting him off while he fights with depression. Meanwhile they later discovered they were Hiv positive too, and they all got infected back at their university days.",
A Lonely lane,,,Vincent D. Anointed,Alexander BenVictor IykeStanley Nweze,"A young man discovers he is Hiv positive, this lead to his friends cutting him off while he fights with depression. Meanwhile they later discovered they were Hiv positive too, and they all got infected back at their university days.",
Care for Her like It's Your Body,,,,,The film is a testimony of how one in a violent relationship can escape with the Help of the Lord,1h
Sun's travelers,,,Sandro Flores,Sandro Flores,"Nick passes on peacefully one morning and his spirit goes wandering through the Sun. Marco, who misses him greatly, has believed in Heaven all his life - until now.",
The Traveler-mosafer,"5,3",,Ali Hatef,Ali Hatef,"Maryam lands at the Los Angeles International airport to look for her vanished U.S citizen husband of 11 Months. Not knowing anyone, she asks a random taxi driver Ali for his help with the search. While searching for Maryam's husband on the endless California roads the two develop true feelings for one another.",1h 26min
Streets of a Scion,,,Gabriel Duran,Gabriel Duran,"The story is about Bobby a 17-year-old kid who recently lost his dad to the game. Having to reconnect with her family Sofia (Bobby's mom) moves them to the back to the barrio where Bobby isn't a welcomed sight. Conflicting with his family Bobby is stuck between friends, family and his Identity. This film Isn't about one person, it has an underlined subject matter of r... Leer todo",2h 21min
Iraade,,,Marina Libik,Marina Libik,,1h 24min
GST - Galti Sirf Tumhari,"4,3",,Suryakant Tyagi,Raju KulkarniRaju Kulkarni,"All goes well for a group of friends and their respective romantic partners when they fall in love. However, things start taking a dark turn when love gives way to deceit and revenge.",2h 14min
Amun,,,Anar Abbasov,Anar AbbasovIvan Zavaruev,"A broken man takes a desert journey, in search of a mysterious monk with rumored powers, in this tale. Faced with temptation and danger, the man risks everything to find healing.",1h 23min
New Queer Visions: Men from the Boys,"6,3",,David Bonneville(segment Cigano)Rory Dering(segment Pittsburgh)James Dunstan(segment Spilt Milk),Dillon Beagley(segment Spilt Milk)David Bonneville(segment Cigano)Rory Dering(segment Pittsburgh),"A compilation of short films exploring first love, revenge, new beginnings and more are unwrapped in this exciting collection from first-time directors from Portugal, Taiwan, Belgium, the UK and the USA.",1h 55min
Rangeela,,,Ravi Sinha,,,2h 41min
Rabba Ishq Na Hove,,,Pramod Shastri,,,2h 41min
Arjun,,,Amir Siddiqui,,,2h
Sipahi,,,Premashu Singh,,,2h 46min
Saiyaan Superstar,,,Ajay Kumar,Dhananjay Kumar,,2h 19min
Prem Pyar Me,,,Pappu Bharti,,,2h 10min
Pattern of Mothers,,,Annie Johnson,,The Price you pay for the sins of your mother.,2h
Superstar,"9,4",57%,Bhavin WadiaKhushbu Savaliya,Deep Patel,A media storm follows a famous actor after he is wounded during a shooting scene in which fake bullets were replaced with real ones.,
Hot Boy Nôi Loan 2,"5,4",,Ngoc Dang Vu,Ngoc Dang Vu,"Continuing the story of the first part, Lam returned to Saigon to continue callboy, after 4 years of searching for Khoi in vain. Here, he meets Long again. Long also worked as a prostitute and secretly loved Lam. Thinking that Lam was dead, Long quit his job but did not give up his unrequited love. Another character named Cuoi is a one-sided lover of Long.",1h 24min
Du soleil dans nos yeux,,,Cyril Masson,Cyril Masson,"Cedric and François are friends. One of them comes from Paris and is a filmmaker, the other one comes from Roma and is a detective. Both travel to Dijon: Cedric wants to visit his father and François, his daughter. The father disappeared. During this visit, Cedric proposes to François to come with him. He accepts and plays the game. When François returns to Roma, he o... Leer todo",
Back to Freeport,,,Jian HenningsKyle Sahadeo,Jian HenningsKyle Sahadeo,"Relocating from the busy city of Port of Spain to his childhood home in rural Freeport; Jamal interacts with visions of his youth while attempting to reconstruct his dilapidated home, all in the hopes of making up for past mistakes.",1h 40min
Tehdy spolu,,,Marta Santovjáková GerlíkováJirí Novotný,Marta Santovjáková GerlíkováPetr Kubelik,,1h 15min
Guilty,,40%,Rodrigo Ugarte,Rodrigo Ugarte,,
Wu zui zhi cheng,"6,6",,Chenyang Yin,Chao Shi,,1h 15min
Kaaliyan,"5,2",,Jijo Pancode,Shaji P. Chelachuvadu,"Kaaliyan is a Malayalam movie starring Kulappulli Leela, Meghanathan Nair and Tini Tom in prominent roles. It is an action drama directed by Jijo Pangode.",1h 44min
The last midnight chapter 2: The Wicked Die Young,"6,7",,Ricardo Zenteno,Marisol EstrellaRicardo Zenteno,"after the events of the last midnight, Hansel wants to find an answer of what happen to him and his friends, however maleficent is back and now is in a little girl which is Hansel babysit girl.",1h 33min
Class Diaries,,,,,"""Class Diary"" follows the daily routines of three women - a young trans woman, an imprisoned mother and a housekeeper - all of whom are students at adult literacy centers in Salvador, Brazil. Although these women follow different paths, their trajectories coincide around the quotidian prejudices and injustices that they face. This Direct Cinema documentary focuses on ... Leer todo",1h 14min
Pretty Little Thing,,,Ugezu J. Ugezu,Dino OkekeVera C. Uzokwe,"A strict, religious father struggles to control the romances developing in his family and household.",2h 36min
Mehandi Laga Ke Rakhna,"7,5",,Rajnish Mishra,,,2h 40min
Hidden Summer,,,,,,1h 9min
Grew up,,,,,,
Bloodthirsty Monster in the Demonic Realm,,,Yan Hongbing,,,
Moy luchshiy Drug,,,Elina Suni,,,2h
The Innovation of Loneliness,"5,8",,Ashlynne Kelly JonesDavashni Rajoo,Davashni Rajoo,"A group of youngsters including a 10 year old boy are being admitted into rehab for social media addiction. This movie is to make parents aware that if technology is not monitored correctly, our children may be deeply affected.",1h 30min
Birani Sardar,,,Gandhi Brothers,,,
Tu Hi to Meri Jaan Hai Radha 2,,,Shammi Tiwari,Veeru Thakur,,2h 36min
Bitiya Hamaray Zamanay Mein,,,Azfar Ali,Mansoor Saeed,"It is a story of 3 mothers, one who wants her son to get married, second who already get her son in a wedlock and third is a stepmother of our lead named Iraj and both didn't share good relationship but Iraj has good relation with her father and now Iraj is all grown-up and falls for Fahad. Fahad is his parents only child and her mother is very possessive and conserva... Leer todo",1h 16min
Boro Chele,"8,0",,Mizanur Rahman Aryan,Mizanur Rahman Aryan,"Rashed, an educated but unemployed young boy, who also happens to be the eldest son of his family, has to face many barriers in life.",
Love Is Cold,"4,9",,Fei Ho,,"A brutal murder mystery sets off small-town controversy in a crime drama. When a teenage woman faces bullying in her new high school, she finds a friend in a young man with mob ties.",1h 32min
Ta ke la ma gan de gu sheng,,,,,,
Kebrite Sookhte,"4,0",,Kazem Ma'asoumi,Zamyad Sa'advandian,"Kaveh hits a pedestrian with his car and is arrested. His father-in-law, Haji Tavasoli guarantees him to be released. When released from prison, Kaveh finds out his brother is killed and.",1h 41min
Invisible Battalion,"7,5",,Alina GorlovaSvitlana LishchynskaIryna Tsilyk,,"Despite the stereotypes, the armed conflict in eastern Ukraine involves Ukrainian women too. The ""Invisible Battalion"" will show the world the role of women in the war.",1h 29min
Pawan Raja,"8,4",,Arvind Choubey,Veeru Thakur,,2h 32min
Yoddha Arjun Pandit,,,Jagdish A. Sharma,,,2h 22min
Ihe Ba Pyar Ke Rang Hajar,,,Braj Bhusan Udasin,,,2h 10min
Baap Re Baap,,,G.J. Rocks,,,2h 45min
Tohare Me Basela Pran,,,Amit Kumar Verma,,,2h 2min
Main Sehra Bandh Ke Aaunga,"9,0",,Rajnish Mishra,,,2h 2min
Gundey,,,Balkar Singh Bali,Om Prakash Yadav,,2h 56min
Balma Rangrasiya,,,Omkar Anand,,,2h 39min
Sugna 2,,,Ajay .K. Ojha,,,2h 57min
Muqaddar,,,Shekhar Sharma,,,2h 54min
The Red Resurrection,"4,9",,Matt Long,Matt Long,"Now 'resurrected' from a living death, a fearful and fractured young woman must overcome, not only the memories of what she was, but the monsters and men created by a deadly plague.",1h 59min
Los lobos del Este,,,Carlos Quintela,Abel Arcos SotoCarlos QuintelaFabián Suarez,,1h 20min
Hams Al-Maâ,"8,6",,Taieb Louhichi,Taieb Louhichi,"The return of an exiled man, tormented by his past, a lover and a militant. The director, returns to bring up the spirit of The Opera Didon and Aeneas of Purceil that he had to abandon 25 years ago. It is also a chronicle of the daily life and place of the new opera, Sidi Bou Said, after the Tunisian revolution.",1h 27min
Voices of Faith,,,Alan Farber,Elias Ehlers,,
Nirahua Hindustani 2,"6,0",,Manjul Thakur,,,2h 46min
Sanwariya Mohe Rang De,,,Dilip Gulati,Paras Jaiswal,,2h 37min
Bairi Bhail Sajanwaa Hamaar,,,Dilip Gulati,,,2h 25min
Challenge,,35%,Satish Jain,,,2h 41min
Bhagya Na Jane Koi,,,Dilip Gulati,Paras Jaiswal,,2h 2min
Rani Dilwar Jani,,,Bali Singh,,,1h 52min
Dilwala,"8,9",,Satish Jain,,,2h
Hum Hai Lootere,,,Raju,,,2h 38min
People Like Us,,,Nigel Townsend,Judith Johnson,,1h
Dhekrayet Porto Farina,"8,2",,Kamel Ben Ouanes,Kamel Ben OuanesJean-Claude Versini,"Tells the childhood memories of little Claude, son of a guardian in the terrible prison of Porto Farina. The child discovers a world shared between the downfall of the convicts and the beauty of a village bathed in a warm light.",1h
Rezk El-Bey Lik,"8,4",,Habib Mselmani,Naceur Kesraoui,"Three officers sent by the Bey, arrives to a farming village to collect taxes. The villagers initiate the payoff sharing their goods but the bey's messengers persist in humiliating them, infringing their dignity and honor, which triggered contestations.",3h 20min
Giac Mo My,"4,0",,Davina Hong Ngan,Davina Hong Ngan,,1h 43min
Ke Trôm Chó,,,Nguy Minh Khang,Nguy Minh Khang,,1h 36min
Desert of No Return,"5,1",,Eun-ki Ko,Song Jin HwaEun-nim Ko,"Tae Shik tries to make a living collecting recyclables, but doesn't see a way out. Soo Eun dreams of becoming a nail artist and is a lesbian, but she is actually a call girl for men. The two of them end up spending a night together on a path to murder.",1h 46min
Mat Bien,,,Dang Thai Huyen,,,
Mor Sangee,"8,4",,Probin Lakra,Probin Lakra,,
Idyll Nights,,,Brandon Gass,Brandon Gass,,
The Fox's Summer 2,"7,6",,,,"Gu Cheng Ze is the CEO of the Gu Mall Corporation. His adopted family wants him with the job of grooming their biological son, Gu Jin Yu, to take over the reigns of the family corporation and separate him from his ex-girlfriend,Li Yan Shu.",
2:22,"5,7",,Paul Currie,Todd SteinNathan Parker,"La vida de un hombre descarrila cuando un siniestro patrón de eventos se repite exactamente de la misma manera cada día, terminando exactamente a las 2:22 p. m.",1h 38min
Life as a young person,,,Onkale Rinker,Onkale Rinker,,
Nani Bai Ro Mayro,,,Rajendra Gupta,,,2h
Gli spettatori,,,Alessandro Derviso,Piero Disogra,,1h 25min
Three the Movie,"7,7",,Yassine Marco MarroccuElisabetta Minen,Elisabetta Minen,"The number three is everything in this movie. Three and its multiples. Archaic, spiritual, transcendent numbers. Three, Six, Nine. Carriers of wisdom that lead us to the heart of theological monotheisms. Three, the Christian Trinity. Six, the points of the Star of David, The Jewish Star. Nine, the face of God in Sufi tradition, according to Islamic culture. Three stor... Leer todo",1h 39min
The Public Enemy,,,Tyler Richards,Tyler Richards,A reimagining of the 1931 film of the same name. Two inner city brothers and their tumultuous struggle against their local drug dealer. The Public Enemy is a menace that the public must solve. By any means neccessary.,1h 15min
Daughters love,,,Chima Oriji,,,
Iqro: Petualangan Meraih Bintang,"7,5",,Iqbal Alfajri,Aisyah AmirahTatia,"Aqila, 9 years old, will learn to read the Qur'an in a Iqro method, which is fun, rhythmic and sung lightly. Aqila's experience inspires her mind of the greatness of Allah who created the universe.",1h 37min
Myujikku no kodomotachi,,,,,,1h 15min
Jousou kazoku,,,Hiroyuki Takebayashi,Takashi Imahashi,,1h 20min
The Body Tap Massacre,,,Coquie Hughes,Coquie Hughes,,1h 4min
Dhakad Lover,,,Ramveer Tomar,Avnish Kumar Singh,,2h 6min
Shaan,,58%,Dinesh Chaudhary,Mukesh Tomer,,1h 4min
Chakkar,,,Ramveer Tomar,Deepak Bhardwaj,,1h 22min
Khataara,,,Uttar Kumar,Avnish Kumar Singh,Satyaveer works in a NGO in remote area. He goes to pickup a girl from the stand by a khatara van. who's coming from the city to come to work with him. They have a lot of trouble on the way due to bad carriage.,1h 9min
The Death Story of Sohrab,"6,7",,Farshad Ahmadi Dastgerdi,Farshad Ahmadi Dastgerdi,An experimental film Rostam and Sohrab from the stories of Shahnameh Ferdowsi.,2h 10min
Dead & Juicy,,,John Bock,,,
Antareen,,,Monjul Baruah,Rita Chowdhury,"Fathered by a politician's loveless extramarital passion, Tarali's life is a quest for sanctuary from her father's loveless world, but her intent to uncover her father's transgression gets her trapped in a mental asylum. In that very trap, she finds Samiran who takes up her fight against the wrongs of a patriarchal world.",2h 3min
La Medea,,,Yara Travieso,Catherine CorreaJonathan David KaneYara Travieso,,1h 15min
We Meet Again,,,Osayande Onaghise,Kelechi Nwaturuba,,52min
Desert Drifters,,,Marcello Montesanti,Marcello Montesanti,,1h 39min
Richard III,,,Itari Marta,Itari MartaWilliam Shakespeare,"The Santa Marta Acatitla Prison Theatre Company performs ""Richard III version 3.0"" an adaptation of William Shakespeare's play from 1633.",
Missing Michael,,,Chris Posen,Chris Posen,,1h 5min
Don't Love Me,"5,9",,Pretty Vacant Boys,,"Dos hombres se conocen por casualidad. Descubren que comparten nombres similares y empiezan a salir. Cocinan, hacen el amor, salen de excursión y conversan mucho para conocerse, pero descubren que no están preparados para el amor.",1h 25min
London Love Story 2,"7,6",,Asep Kusdinar,Sukhdev SinghTisa T.S.,"The continuation of the romance between Caramel (Michelle Ziudith) and Dave (Dimas Anggara) who plan to visit Switzerland for a holiday. However, Dave cancels the trip at the last minute, leaving Caramel alone with another guy.",1h 41min
Promise,"7,6",14%,Asep Kusdinar,Sukhdev SinghTisa T.S.,"Two introverted male college students are friends with totally opposite personalities. As time goes by, they never crossed paths again. 18 months passed, he continued his study in Milan and the secret of his past will revealed.",1h 50min
Twin Flowers,,,Mario Orazio Ruvio,Alex GeorgievMario Orazio Ruvio,,
In My Father's Arms,,,Icko Gonzalez,Icko GonzalezJohn Valdes Tan,A mother and daughter's relationship is strained by the tragic death of the head of the home. His death anniversary reunites them and exposes secrets inciting more tension between the two.,48min
Run-Through,,,Shura Katz,Damien Ave,,
The Ming Dynasty Assassin,"4,5",,Jianan He,Bingjie CaiGary Gao Qiao,"In the waning years of the Ming Dynasty, influential eunuch Wei Zhongxian extends his corrupt control over state affairs for selfish gain.",1h 29min
Agnidahan,,,Ghanshyam Lamichhane,,Agnidahan is social Drama and the film is on the issue of accusing women for practicing witchcraft,1h 58min
Loretta,,,Anthony Dye,Anthony Dye,"A young woman named Loretta falls in love with an actor named Tyler, Everybody is in Loretta's head staying you need to slow down and take your time before you get hurt but she doesn't listen until its too late when Loretta's heart gets broken everybody hearts get broken.",1h 25min
Beauty and the Beast,,,,,,
A Dog's Life,,87%,,,"The film consists of four stories about four different dogs and their owners' lives, reflecting love, life and departure.",1h 20min
Fuori sede,,,Sergio Rubini,Francesco Toto,,
Entraña,,,Jair Torres Baizabal,Jair Torres Baizabal,Ángel and Pablo journey to a cabin in the forest to mend conflicts. Long hidden truths will be uncovered as they discover that the place around them is fraught with threats of a disturbing nature.,2h
Hamlet,,100%,Jens Ohlin,Hannes MeidalJens OhlinWilliam Shakespeare,,1h 48min
La Traversée,,,Zoé LabasseJulie Trillo,Zoé Labasse,,
Bound,,87%,Sharon Sephton,,,45min
Dur,"8,0",,Kangkan Rajkhowa,Kangkan Rajkhowa,"Manab, an artist, a free-mind, is in the hospital, struggling for his life. He is an orphan, but the love of his life, Puja, is beside him. Being his support...memories comes flashing back in her mind...or are they realization of something ominous that had happened in the past. Or shouldn't have happened rather. Something which changed their life forever. This is the ... Leer todo",2h 14min
Alexander I: Into the Woods,,,Sasha Yevtushenko,Mike Walker,,58min
"Catherine the Great: Husbands, Lovers and Sons",,,Sasha Yevtushenko,Mike Walker,,58min
Kid Normal,,,Greg James,,,
Corneador,"5,9",,Harold Mota,Harold Mota,"Many marriages have dark and secret agreements. This is well known to Lázaro (Samuel Pacheco), who goes from practicing as a lawyer to working as a gigolo. He must only do one thing: satisfy the sexual needs of the wives of gentlemen who pay him to see them enjoy. However, in the course will begin to incur the cornudismo, a strange sexual practice. What consequences w... Leer todo",1h 19min
Naryaa,,,Jalindar KhandgaleAjit Gade(director:)Hemangi Kakde(second ad),Laxman Gurav,,
Organic Motion Pictures (Production House),,,,,,
Ghost in the Shell,"6,3",95%,Rupert Sanders,Shirow MasamuneJamie MossWilliam Wheeler,"En un futuro cercano, Mira Killian es la primera de su clase: una humana salvada de un terrible accidente, que ha sido mejorada cibernéticamente para ser una soldado perfecta dedicada a detener a los criminales más peligrosos del mundo.",1h 47min
